club,id,createdAt,favorites,retweets,text
Narendra Modi,1516356535412301829,2022-04-19 10:02:25+00:00,5422,1712,છેલ્લા કેટલાક વર્ષોમાં બનાસકાંઠામાં પાણીની સ્થિતિ સુધારવા માટે વ્યાપક કામગીરી કરવામાં આવી છે જેનાથી ખેડૂતોને ઘણી રાહત થઈ છે. https://t.co/zQDNaHFqur
Narendra Modi,1516354741290389504,2022-04-19 09:55:17+00:00,17845,3299,"The goodwill of Jam Saheb’s family is spread all over the world, especially in Europe. In Jamnagar, I had the opportunity to meet Jam Saheb Shri Shatrusalyasinhji, who has always been extremely affectionate towards me as an elder. We had a great time recollecting old memories. https://t.co/i6BERFGSpl"
Narendra Modi,1516353830493081607,2022-04-19 09:51:40+00:00,14965,2644,જામ સાહેબના પરિવારની સુવાસ આજે પણ દુનિયામાં અને ખાસ કરીને યુરોપમાં મહેકે છે. એક વડીલ બંધુ તરીકેનો સ્નેહ જેમના તરફથી મને હંમેશાં મળ્યો છે એવા જામ સાહેબ શ્રી શત્રુશલ્યસિંહજી સાથે મુલાકાત કરી. જૂની વાતો વાગોળવાનો અવસર પ્રાપ્ત થયો. https://t.co/gTnxmcFadp
Narendra Modi,1516336954010484738,2022-04-19 08:44:36+00:00,10019,2690,Glimpses from my visit to @banasdairy1969. The Dairy is equipped with modern infrastructure and is contributing to India’s strides in the dairy and animal husbandry sectors. https://t.co/0tFCnjBiUa
Narendra Modi,1516335534968254468,2022-04-19 08:38:58+00:00,13600,3068,Spent time at the impressive Potato Processing Plant at the @banasdairy1969 complex. This factory is all about value addition and is testimony to the innovative zeal of the people of Banaskantha. https://t.co/RV9zj3UPuH
Narendra Modi,1516334111438553090,2022-04-19 08:33:18+00:00,6303,2139,"बनास डेयरी ने जिस प्रकार Cheese और Whey पाउडर प्लांट की क्षमता में वृद्धि की है, उसका सीधा लाभ हमारे पशुपालक भाई-बहनों को मिल रहा है।  @banasdairy1969 https://t.co/gV4VDRXfcl"
Narendra Modi,1516333832819310593,2022-04-19 08:32:12+00:00,5565,2011,"गांवों और पशुपालकों को किस प्रकार आत्मनिर्भर बनाने में जुटी है बनास डेयरी, देखिए…  @banasdairy1969 https://t.co/d9Wa7cbo9x"
Narendra Modi,1516332471985573892,2022-04-19 08:26:48+00:00,5572,2048,बनासकांठा में स्थापित हुआ कोऑपरेटिव पोटैटो प्रोसेसिंग प्लांट देश के लिए गौरव का विषय है। किसानों की आय बढ़ाने में इसकी भूमिका बहुत प्रभावी रहने वाली है।   @banasdairy1969 https://t.co/5gNHSjHLa8
Narendra Modi,1516332185980129282,2022-04-19 08:25:39+00:00,8743,2596,बनास डेयरी का सनादर डेयरी प्लांट दूध उत्पादन के क्षेत्र में मील का पत्थर साबित होने वाला है। https://t.co/xHk5G7q1W2
Narendra Modi,1516296470521344004,2022-04-19 06:03:44+00:00,12186,3448,Initiatives at Banas Dairy will empower farmers and boost rural economy. https://t.co/QbTQdqyMJX
Narendra Modi,1516250767665074179,2022-04-19 03:02:08+00:00,18093,3685,I am delighted to be visiting @banasdairy1969 yet again. I had last visited the Dairy in 2016. That time a series of products of the Dairy were launched. I had also visited the Dairy in 2013. Here are glimpses from both programmes. https://t.co/J8xlTPHT6e
Narendra Modi,1516093629856874500,2022-04-18 16:37:43+00:00,18000,3798,Sharing some glimpses from my visit to the Vidya Samiksha Kendra in Gandhinagar. It is commendable how technology is being leveraged to ensure a more vibrant education sector in Gujarat. This will tremendously benefit the youth of Gujarat. https://t.co/ezRueOdfjq
Narendra Modi,1516093025931644930,2022-04-18 16:35:19+00:00,9168,2356,ગાંધીનગરમાં “વિદ્યા સમીક્ષા કેન્દ્ર”ની મારી મુલાકાત વેળાના કેટલાક દ્રશ્યો શેર કરું છું.  ગુજરાતમાં શિક્ષણ ક્ષેત્રને પ્રગતિશીલ  બનાવવા માટે ટેક્નોલોજીનો જે રીતે ઉપયોગ કરવામાં આવી રહ્યો છે તે પ્રશંસનીય છે. આનાથી રાજ્યના યુવાનોને ખૂબ લાભ થશે. https://t.co/6HrquKqLgG
Narendra Modi,1516064345071173634,2022-04-18 14:41:21+00:00,16324,2801,"Earlier today, had a fruitful meeting with Manipur CM @NBirenSingh Ji and Ministers from the Manipur government. Was happy to learn about the various good governance efforts of the Manipur government. https://t.co/sSs0770isb"
Narendra Modi,1516052925730426880,2022-04-18 13:55:59+00:00,13584,3564,At the Vidya Samiksha Kendra in Gandhinagar. https://t.co/kN5pSFO1ig
Narendra Modi,1515975931499745282,2022-04-18 08:50:02+00:00,8845,2003,"டேபிள் டென்னிஸ் சாம்பியன் விஷ்வா தீனதயாளனின் மறைவு அதிர்ச்சியும், வேதனையும் அளிக்கிறது. சக வீரர்களால் போற்றப்பட்ட இவர், பல போட்டிகளில் பங்கேற்று தனித்து விளங்கினார். இந்த துயரமான நேரத்தில் எனது எண்ணங்கள் அவரது குடும்பத்தினர் மற்றும் நண்பர்களுடன் உள்ளன. ஓம் சாந்தி."
Narendra Modi,1515975884833902593,2022-04-18 08:49:51+00:00,21311,3403,The demise of TT champion Vishwa Deenadayalan is shocking and saddening. He was admired by fellow players and had distinguished himself in several competitions. In this tragic hour my thoughts are with his family and friends. Om Shanti.
Narendra Modi,1515892898096873476,2022-04-18 03:20:05+00:00,13863,3959,"जनभागीदारी किस प्रकार किसी देश के विकास में नई ऊर्जा भर सकती है, स्वच्छ भारत अभियान इसका प्रत्यक्ष प्रमाण है। शौचालय का निर्माण हो या कचरे का निष्पादन, ऐतिहासिक धरोहरों का संरक्षण हो या फिर सफाई की प्रतिस्पर्धा, देश आज स्वच्छता के क्षेत्र में नित नई गाथाएं लिख रहा है। https://t.co/1FzV3yyfHg"
Narendra Modi,1515890597332393988,2022-04-18 03:10:56+00:00,9263,1628,ଶ୍ରୀଯୁକ୍ତ ପ୍ରଫୁଲ୍ଲ କରଙ୍କ ଦେହାନ୍ତ ଖବର ଶୁଣି ମର୍ମାହତ । ଓଡ଼ିଆ ସଂଗୀତ ଓ ସଂସ୍କୃତି ପାଇଁ ତାଙ୍କର ଅନନ୍ୟ ଯୋଗଦାନ ତାଙ୍କୁ ସ୍ମରଣୀୟ କରି ରଖିବ । ଶ୍ରୀଯୁକ୍ତ କର ଅନେକ ପ୍ରତିଭାର ଅଧିକାରୀ ଏବଂ ତାଙ୍କର ସୃଜନଶୀଳତା କାର୍ଯ୍ୟରେ ପ୍ରତିଫଳିତ ହୁଏ । ପରିବାର ଏବଂ ପ୍ରଶଂସକଙ୍କୁ ସମବେଦନା ଜଣାଉଛି । ଓଁ ଶାନ୍ତି ।
Narendra Modi,1515890531167260674,2022-04-18 03:10:41+00:00,16516,2783,Anguished by the passing away of Shri Prafulla Kar Ji. He will be remembered for his pioneering contribution to Odia culture and music. He was blessed with a multifaceted personality and his creativity was reflected in his works. Condolences to his family and admirers. Om Shanti.
Narendra Modi,1515692433291747328,2022-04-17 14:03:30+00:00,19553,3746,"Starting tomorrow, 18th April, I will be on a two day visit to Gujarat during which I will join programmes in Gandhinagar, Banaskantha, Jamnagar and Dahod. These programmes will cover different sectors and will boost ‘Ease of Living’ for people.   https://t.co/0CINQbss8S"
Narendra Modi,1515540159176986627,2022-04-17 03:58:25+00:00,20082,3350,Chandra Shekhar Ji was a towering personality who was widely admired for his commitment to democratic values and efforts to remove poverty. He always worked for the welfare of the downtrodden and marginalised. Tributes to him on his birth anniversary.
Narendra Modi,1515525369402576899,2022-04-17 02:59:39+00:00,13096,2919,"Here is an interesting magazine on last month’s #MannKiBaat in which we discussed diverse topics like India’s exports jump, Ayurveda start-ups, water conservation and traditional fairs. Do join the next episode on the 24th. https://t.co/zXUYIrR3bk"
Narendra Modi,1515524575127224324,2022-04-17 02:56:30+00:00,31060,4007,Happy Easter! We recall the thoughts and ideals of Jesus Christ and the emphasis on social justice as well as compassion. May the spirit of joy and brotherhood be furthered in our society.
Narendra Modi,1515307907898036225,2022-04-16 12:35:32+00:00,37828,5308,My sincere condolences on the passing of Bilquis Edhi. Her life long dedication to humanitarian work touched the lives of people across the globe. People in India too remember her fondly. May her soul rest in peace.
Narendra Modi,1515299235276922880,2022-04-16 12:01:05+00:00,35024,5673,"Met senior BAPS Sadhus, Ishwarcharan Swami and Brahmavihari Swami. Appreciated BAPS relief work in the time of COVID-19 and during the Ukraine crisis. Discussed the upcoming birth centenary celebrations of HH Pramukh Swami Maharaj Ji and recalled his rich contribution to society. https://t.co/Y4se8vkwM3"
Narendra Modi,1515204747346599939,2022-04-16 05:45:37+00:00,27787,6509,"Inaugurating a 108 feet statue of Hanuman ji in Morbi, Gujarat. https://t.co/6M0VOXXPmk"
Narendra Modi,1515187242150506503,2022-04-16 04:36:04+00:00,8872,2509,I enjoy interacting with our dynamic #ExamWarriors.   Pariksha Pe Charcha is a vibrant forum for many issues relating to exams and life.   Insights from all of these interactions can be found in this innovatively curated section on the NaMo App.   https://t.co/EegBatrBwJ
Narendra Modi,1515161686453329920,2022-04-16 02:54:31+00:00,13709,3461,"देश के विकास में हमारे असंगठित श्रमिक भाई-बहनों की भागीदारी बहुत महत्वपूर्ण है। ऐसे करोड़ों कामगारों के जीवन को आसान बनाने के लिए हमारी सरकार सदैव प्रयासरत रही है। इन योजनाओं से जहां उनकी सामाजिक सुरक्षा सुनिश्चित हुई है, वहीं महामारी के दौरान भी मदद के लिए कई और कदम उठाए गए। https://t.co/NvZwP0Qc0B"
Narendra Modi,1515161120809512964,2022-04-16 02:52:16+00:00,69653,10881,"Today, we mark the special occasion of Hanuman Jayanti. In Morbi, at 11 AM, a 108 feet statue of Hanuman ji will be inaugurated. I am honoured to be getting the opportunity to be a part of this programme via video conferencing.   https://t.co/qjvLIHWWiO https://t.co/kbHcIxd90Z"
Narendra Modi,1515160381433401350,2022-04-16 02:49:19+00:00,93790,14632,"शक्ति, साहस और संयम के प्रतीक भगवान हनुमान की जयंती पर सभी देशवासियों को अनेकानेक शुभकामनाएं। पवनपुत्र की कृपा से हर किसी का जीवन बल, बुद्धि और विद्या से सदा परिपूर्ण रहे।"
Narendra Modi,1515000526462722055,2022-04-15 16:14:07+00:00,25836,3864,Had a wonderful meeting with district Panchayat Members from Gujarat. They had insightful views on ways to improve the quality of life and infrastructure in the villages. https://t.co/sxztdlk9th
Narendra Modi,1514947198412369928,2022-04-15 12:42:13+00:00,21225,3445,"Spoke with General Secretary of Communist Party of Vietnam H. E. Nguyen Phu Trong today. We exchanged views on a range of bilateral, regional and global issues and agreed to promote closer cooperation in our economic, trade and defence engagement."
Narendra Modi,1514850824362463233,2022-04-15 06:19:15+00:00,14527,3670,हिमाचल दिवस के खास अवसर पर मेरा संबोधन... https://t.co/RhhTNbRHVm
Narendra Modi,1514843001486397440,2022-04-15 05:48:10+00:00,12685,3410,Hospital in Bhuj will make good quality healthcare accessible to people at affordable price. https://t.co/ip4Y9sNVyz
Narendra Modi,1514800638017736706,2022-04-15 02:59:50+00:00,36884,4665,We remember the courage and sacrifices of Jesus Christ today on Good Friday. His ideals of service and brotherhood are the guiding light for several people.
Narendra Modi,1514799299271356417,2022-04-15 02:54:31+00:00,22618,3827,Greetings on Vishu! https://t.co/ymI3oIFQWn
Narendra Modi,1514798813470371845,2022-04-15 02:52:35+00:00,20341,3725,Shubho Nabo Barsho!  Best wishes on Poila Boishakh. https://t.co/Nfle3Erb9Z
Narendra Modi,1514625200846999561,2022-04-14 15:22:42+00:00,8749,2579,This is an interesting quiz which will cover a series of good governance initiatives.   Do take part in the #SabkaVikasMahaQuiz and strengthen our collective quest towards inclusive development. https://t.co/t50ODAlMua
Narendra Modi,1514617591838359565,2022-04-14 14:52:28+00:00,33150,6750,Do visit the Pradhanmantri Sangrahalaya and know more about all our PMs… https://t.co/A8ok1Y4YFL
Narendra Modi,1514616617178566670,2022-04-14 14:48:36+00:00,20413,2919,Happy to have met you @rickykej! Your passion and enthusiasm towards music keeps getting even stronger. Best wishes for your future endeavours. https://t.co/8kalYNCaK9
Narendra Modi,1514615870298857486,2022-04-14 14:45:38+00:00,9784,2266,"At 11 AM tomorrow, 15th April, the KK Patel Super Speciality Hospital in Bhuj will be dedicated to the nation. The hospital will significantly augment health infrastructure in Kutch. I look forward to being a part of the programme via video conferencing. https://t.co/CMWVlNYMZO"
Narendra Modi,1514575371249012738,2022-04-14 12:04:42+00:00,29110,5086,Sharing some more glimpses from the Pradhanmantri Sangrahalaya. https://t.co/6Hfhe0FVTA
Narendra Modi,1514568588262526977,2022-04-14 11:37:45+00:00,26800,4650,Some glimpses from the programme to inaugurate the Pradhanmantri Sangrahalaya in Delhi. https://t.co/WJaf1fpQRg
Narendra Modi,1514564177792503808,2022-04-14 11:20:13+00:00,11127,3022,"आज जब विश्व भारत को आशा और विश्वास भरी नजरों से देख रहा है, ऐसे समय में प्रधानमंत्री संग्रहालय हमें निरंतर प्रेरणा देने का काम करेगा। https://t.co/Y5UAARTKcv"
Narendra Modi,1514564138487676934,2022-04-14 11:20:04+00:00,8518,2523,"देश से चोरी हुई मूर्तियों और कलाकृतियों को वापस लाना हो, पुराने म्यूजियम का पुनर्निर्माण हो, नए संग्रहालय बनाना हो, इनसे जुड़ा एक बहुत बड़ा अभियान बीते 7-8 वर्षों से लगातार जारी है।  इन प्रयासों के पीछे एक और बड़ा उद्देश्य है… https://t.co/0ehB2KKsld"
Narendra Modi,1514564099845541890,2022-04-14 11:19:55+00:00,7694,2212,"Democracy is firmly rooted in India’s history, culture and ethos.   The Pradhanmantri Sangrahalaya will further deepen the connect between our people and democratic spirit. https://t.co/SBtcex7dnD"
Narendra Modi,1514563986641264644,2022-04-14 11:19:28+00:00,6224,1968,"From the ramparts of the Red Fort I have said that in the making of our nation, every Government, every Prime Minister has role.   This spirit is reflected in the Pradhanmantri Sangrahalaya. https://t.co/PDVWoG6XUv"
Narendra Modi,1514546719593492489,2022-04-14 10:10:51+00:00,7406,1495,"ਖਾਲਸਾ ਸਾਜਨਾ ਦਿਵਸ ਦੇ ਵਿਸ਼ੇਸ਼ ਅਵਸਰ 'ਤੇ ਸਭ ਨੂੰ ਖਾਸ ਕਰਕੇ ਸਿੱਖਾਂ ਨੂੰ ਵਧਾਈਆਂ। ਖਾਲਸਾ ਪੰਥ ਦੁਨੀਆ ਭਰ ਦੇ ਅਣਗਿਣਤ ਲੋਕਾਂ ਨੂੰ ਪ੍ਰੇਰਿਤ ਕਰਦਾ ਹੈ। ਇਸ ਤੋਂ ਪ੍ਰੇਰਿਤ ਹੋ ਕੇ, ਸਿੱਖਾਂ ਨੇ ਵੱਖ-ਵੱਖ ਖੇਤਰਾਂ ਵਿੱਚ ਵਿਸ਼ਵ ਪੱਧਰ 'ਤੇ ਆਪਣੀ ਵੱਖਰੀ ਪਹਿਚਾਣ ਬਣਾਈ ਹੈ।"
Narendra Modi,1514546511874785283,2022-04-14 10:10:02+00:00,17264,2933,"Greetings to everyone, especially the Sikhs on the special occasion of Khalsa Saajna Diwas. The Khalsa Panth motivates countless people across the world. Inspired by it, Sikhs have distinguished themselves globally in diverse fields."
Narendra Modi,1514509584245084164,2022-04-14 07:43:17+00:00,11563,3305,Speaking at the inauguration of Pradhanmantri Sangrahalaya in Delhi. https://t.co/I2ArKZRJdg
Narendra Modi,1514469821857275908,2022-04-14 05:05:17+00:00,22094,4578,"दलितों, पीड़ितों, वंचितों और शोषितों के कल्याण के लिए बाबासाहेब के विचार हमारी सरकार के लिए प्रेरणापुंज रहे हैं। यही वजह है कि हमारी सभी योजनाएं गरीब से गरीब को ध्यान में रखकर लागू की गई हैं और सामाजिक न्याय की दिशा में हमने कई मानदंड तय किए हैं। https://t.co/dOJixnlLOj"
Narendra Modi,1514469403043139584,2022-04-14 05:03:37+00:00,102872,10601,"Today, on Ambedkar Jayanti, paid tributes to Dr. Babasaheb Ambedkar in Delhi. https://t.co/V5EIIObRwh"
Narendra Modi,1514440285828222982,2022-04-14 03:07:55+00:00,21824,4628,"Mahavir Jayanti greetings to you all.   We recall the noble teachings of Bhagwan Mahavir, especially the emphasis on peace, compassion and brotherhood. https://t.co/CyKPtNPKZi"
Narendra Modi,1514439578194567168,2022-04-14 03:05:07+00:00,20541,4093,Greetings on the auspicious occasion of Puthandu. https://t.co/BnxhEqRBIv
Narendra Modi,1514438331999817732,2022-04-14 03:00:09+00:00,13667,2922,Happy Odia New Year! May the coming year be filled with joy and good health. https://t.co/vaCfpNwn6G
Narendra Modi,1514437088053121026,2022-04-14 02:55:13+00:00,13915,2691,Bohag Bihu greetings to everyone! https://t.co/W5UWbLJhiF
Narendra Modi,1514435990030458880,2022-04-14 02:50:51+00:00,21917,3749,Best wishes on the special occasion of Baisakhi. https://t.co/1quwFoRKyM
Narendra Modi,1514435251292217345,2022-04-14 02:47:55+00:00,19757,4978,Tributes to Dr. Babasaheb Ambedkar on his Jayanti. He has made indelible contributions to India’s progress. This is a day to reiterate our commitment to fulfil his dreams for our nation. https://t.co/mLTgmJ8tNi
Narendra Modi,1514273697410224131,2022-04-13 16:05:57+00:00,18087,3919,"At 11 AM tomorrow, 14th April, the Pradhanmantri Sangrahalaya will be inaugurated which will showcase the contributions of all our PMs. This programme is taking place when India is marking Azadi Ka Amrit Mahotsav. I would urge everyone to visit the museum. https://t.co/fCSCnuqOnX"
Narendra Modi,1514254150325874688,2022-04-13 14:48:17+00:00,13269,3560,India applauds the heroic efforts of those involved in rescue operation at Deoghar. https://t.co/IYiQhVjI0G
Narendra Modi,1514141801187364866,2022-04-13 07:21:51+00:00,35830,6929,"I’ve spoken about UPI and Digital Payments quite often but I really liked how you’ve used the sound of money transacted through data sonification to effectively convey the point.   Very interesting, impressive and obviously informative! @indiainpixels https://t.co/rpsjejjR9J"
Narendra Modi,1514141341219004416,2022-04-13 07:20:01+00:00,15465,2708,Mwalimu Nyerere's life and his work remain a constant inspiration for all of us. The principles of unity and equality that he advocated are as relevant today as ever. My tributes to the great leader and friend of India on his 100th birth anniversary.
Narendra Modi,1514141007478198274,2022-04-13 07:18:42+00:00,14930,3732,गरीबों का कल्याण ही हमारी सर्वोच्च प्राथमिकता रही है। कोरोना महामारी के दौर में भी हम इसे लेकर प्रतिबद्ध रहे। प्रधानमंत्री गरीब कल्याण अन्न योजना ने देशवासियों को आश्वस्त किया है कि सरकार हर मुसीबत में उनके साथ खड़ी है। https://t.co/A7VDJH6DtQ
Narendra Modi,1514079217691942916,2022-04-13 03:13:10+00:00,21115,3829,"Yesterday, had an excellent meeting with District Panchayat members from Gujarat. We talked at length about issues relating to rural development and leveraging Jan Shakti for societal progress. https://t.co/HOZafnZRlB"
Narendra Modi,1514078223390310401,2022-04-13 03:09:13+00:00,16629,3879,Tributes to those martyred in Jallianwala Bagh on this day in 1919. Their unparalleled courage and sacrifice will keep motivating the coming generations. Sharing my speech at the inauguration of the renovated complex of Jallianwala Bagh Smarak last year. https://t.co/zjqdqoD0q2
Narendra Modi,1513843319859814404,2022-04-12 11:35:47+00:00,43163,7148,उत्तर प्रदेश विधान परिषद के चुनावों में सभी विजयी उम्मीदवारों को बहुत-बहुत बधाई। यह जीत एक बार फिर भाजपा के विकास मॉडल पर जनता-जनार्दन के विश्वास की अभिव्यक्ति है। @myogiadityanath जी की सरकार के साथ ही पार्टी संगठन से जुड़े सभी कार्यकर्ताओं को ढेरों शुभकामनाएं।
Narendra Modi,1513772471203221509,2022-04-12 06:54:16+00:00,18104,4301,"कोरोना से लड़ाई में 130 करोड़ देशवासियों ने जिस संकल्प शक्ति का परिचय दिया है, वो नए भारत के सामर्थ्य की पहचान है। स्वदेशी टीकों के साथ विश्व का सबसे बड़ा मुफ्त वैक्सीनेशन अभियान हो या मेडिकल इंफ्रास्ट्रक्चर का विकास, स्वास्थ्य के क्षेत्र में देश नित नए मानदंड स्थापित कर रहा है। https://t.co/E92ZC9UxcA"
Narendra Modi,1513757709946220544,2022-04-12 05:55:36+00:00,12050,3227,"Blessed to take part in a programme at Shree Annapurna Dham in Adalaj, Gujarat. https://t.co/DCCzCkT0dB"
Narendra Modi,1513556114855501829,2022-04-11 16:34:32+00:00,110279,14729,"Congratulations to H. E. Mian Muhammad Shehbaz Sharif on his election as the Prime Minister of Pakistan. India desires peace and stability in a region free of terror, so that we can focus on our development challenges and ensure the well-being and prosperity of our people."
Narendra Modi,1513539276277190663,2022-04-11 15:27:38+00:00,21276,5385,Addressing the India-US virtual summit with @POTUS @JoeBiden. https://t.co/sgYlj2nqSG
