club,id,createdAt,favorites,retweets,text
Narendra Modi,1539626242735247360,2022-06-22 15:07:55+00:00,34229,6524,"हरियाणा के स्थानीय निकाय चुनावों में भाजपा-जजपा गठबंधन की शानदार जीत के लिए दोनों दलों के कार्यकर्ताओं को ढेरों बधाई। राज्य सरकार जिस प्रकार विकास के पथ पर प्रदेश को निरंतर आगे ले जा रही है, जनता ने उसमें अपना पूरा विश्वास व्यक्त किया है। @BJP4Haryana"
Narendra Modi,1539626149479067648,2022-06-22 15:07:33+00:00,11185,3334,"At 10:30 AM tomorrow, 23rd June, will inaugurate Vanijya Bhawan, the new premises of the Departments of Commerce and Industry. Will also launch a new portal NIRYAT, which would be a one stop place for all info needed on India’s foreign trade. https://t.co/0ZzHaGb5yf"
Narendra Modi,1539586228328181760,2022-06-22 12:28:55+00:00,13976,4462,My remarks at BRICS Business Forum. https://t.co/DX0MiiPrZ2
Narendra Modi,1539283353613918208,2022-06-21 16:25:24+00:00,58394,11720,"Millions of people, especially those who have experienced poverty and faced hardships, derive great strength from the life of Smt. Droupadi Murmu Ji. Her understanding of policy matters and compassionate nature will greatly benefit our country."
Narendra Modi,1539282555198771201,2022-06-21 16:22:14+00:00,115884,22189,"Smt. Droupadi Murmu Ji has devoted her life to serving society and empowering the poor, downtrodden as well as the marginalised. She has rich administrative experience and had an outstanding gubernatorial tenure. I am confident she will be a great President of our nation."
Narendra Modi,1539106737722114049,2022-06-21 04:43:36+00:00,19833,5492,सभी धार्मिक मठ और संस्थानों से मेरा यह आग्रह है… https://t.co/knBEEHjfxY
Narendra Modi,1539106667803164673,2022-06-21 04:43:19+00:00,9398,3280,"We are greatly inspired by the thoughts and ideals of Jagadguru Basaveshwara, particularly the emphasis on serving others and acquiring knowledge. https://t.co/HVOfV6b7FL"
Narendra Modi,1539106592624451585,2022-06-21 04:43:01+00:00,9058,3044,https://t.co/yaaMpCpOeg
Narendra Modi,1539106543093829637,2022-06-21 04:42:49+00:00,11604,3560,Southern India is home to several Mutts which have preserved and celebrated our cultural heritage. https://t.co/mXFZ8ADXvm
Narendra Modi,1539106372226273280,2022-06-21 04:42:09+00:00,18748,4133,"During my visit to Mysuru, I had the opportunity to visit the Suttur Math. Here are glimpses from the programme last evening. https://t.co/GZ6j6fAWa3"
Narendra Modi,1539105620644741121,2022-06-21 04:39:09+00:00,17103,5004,"दुनियाभर के लोगों के लिए योग अब केवल Part of Life नहीं, बल्कि Way of Life बन रहा है।   हमें योग को जानना भी है और जीना भी है। https://t.co/vIt2CoJKvD"
Narendra Modi,1539105548414636032,2022-06-21 04:38:52+00:00,13043,4249,"योग दिवस की व्यापकता और स्वीकार्यता भारत की उस अमृत भावना की स्वीकार्यता है, जिसने देश के स्वतंत्रता संग्राम को ऊर्जा दी थी। https://t.co/zjAhuInjYT"
Narendra Modi,1539086547257114624,2022-06-21 03:23:22+00:00,40480,8508,Participated in the Yoga Day programme in Mysuru. #YogaForHumanity https://t.co/SJxDfEHeOx
Narendra Modi,1539051709858988032,2022-06-21 01:04:56+00:00,21609,6869,Greetings on #YogaDay! https://t.co/dNTZyKdcXv
Narendra Modi,1538941560662159364,2022-06-20 17:47:14+00:00,41992,4789,ಮೈಸೂರಿನ ಶ್ರೀ ಚಾಮುಂಡೇಶ್ವರಿ ದೇವಾಲಯದಲ್ಲಿ ಪ್ರಾರ್ಥನೆ ಸಲ್ಲಿಸಿದೆ. https://t.co/MWyqtkSAlp
Narendra Modi,1538941317644165120,2022-06-20 17:46:16+00:00,7768,1816,'ಸಂವಹನ ಅಸ್ವಸ್ಥತೆಯುಳ್ಳ ವ್ಯಕ್ತಿಗಳಿಗಾಗಿನ ಶ್ರೇಷ್ಠತಾ ಕೇಂದ್ರ'ವು ಅಂಗವೈಕಲ್ಯ ವುಳ್ಳವರಿಗಾಗಿ ಅತ್ಯುತ್ತಮ ಅವಕಾಶಗಳನ್ನೊದಗಿಸುವ ನಮ್ಮ ಪರಿಶ್ರಮದ ಭಾಗವಾಗಿದೆ. https://t.co/2d7DUbvVOs
Narendra Modi,1538940648459759616,2022-06-20 17:43:37+00:00,7485,1807,ವಾಣಿಜ್ಯ ಮತ್ತು ಸಮೃದ್ಧಿಗೆ ಉತ್ತೇಜನ ನೀಡುವ ಅತ್ಯುತ್ತಮ ಸಂಪರ್ಕವನ್ನು ಮೈಸೂರಿನ ಜನತೆಗೆ ಒದಗಿಸುವುದು ನಮ್ಮ ಪ್ರಯತ್ನವಾಗಿದೆ. https://t.co/JapydyDZw4
Narendra Modi,1538940549839060992,2022-06-20 17:43:13+00:00,8787,1785,ಮೈಸೂರಿನಲ್ಲಿ ಜನರು ತೋರಿದ ಪ್ರೀತಿ ನನ್ನನ್ನು ಅತೀವ ವಿನಮ್ರನನ್ನಾಗಿ ಮಾಡಿದೆ. ಈ ಶ್ರೇಷ್ಠ ನಗರದಲ್ಲಿ ವಾಸ್ತವ್ಯ ಹೂಡುತ್ತಿರುವುದಕ್ಕೆ ಆನಂದವಾಗಿದೆ. https://t.co/h2Ww993Vjl
Narendra Modi,1538939741508620288,2022-06-20 17:40:01+00:00,93977,9478,Prayed at the Sri Chamundeshwari Temple in Mysuru. https://t.co/F2s18Iqxyx
Narendra Modi,1538939184844779520,2022-06-20 17:37:48+00:00,9111,2974,The ‘Centre of Excellence for persons with communication disorders’ is a part of our efforts to ensure best opportunities for persons with disabilities. https://t.co/Yh4u85Fqew
Narendra Modi,1538938479866179584,2022-06-20 17:35:00+00:00,9724,2952,It is our endeavour to provide the people of Mysuru with best connectivity which will boost commerce and prosperity. https://t.co/1PzbYeJw8G
Narendra Modi,1538938278136938497,2022-06-20 17:34:12+00:00,16685,3421,I am extremely humbled by the people’s affection in Mysuru. It is a delight to be in this great city. https://t.co/mulJ3epibi
Narendra Modi,1538888164877959168,2022-06-20 14:15:04+00:00,12426,3610,Addressing a programme at Suttur Math in Mysuru. https://t.co/bV0LbpPG3X
Narendra Modi,1538869093105025024,2022-06-20 12:59:17+00:00,10240,3439,"Key projects are being launched in Mysuru, which will benefit the citizens. Watch. https://t.co/ftUCOuGUlO"
Narendra Modi,1538837317863063552,2022-06-20 10:53:01+00:00,6205,1707,ಬೆಂಗಳೂರು ಉಪನಗರ ರೈಲು ಯೋಜನೆಯು ನಗರದ ಮೂಲಸೌಕರ್ಯದಲ್ಲಿ ಪರಿವರ್ತನೆ ತರುತ್ತದೆ. ಇದು ಬೆಂಗಳೂರಿನ ಕ್ರಿಯಾಶೀಲ ಜನರಿಗೆ ಆರಾಮದಾಯಕ ಮತ್ತು ಅನುಕೂಲಕರ ಪ್ರಯಾಣವನ್ನು ಖಚಿತಪಡಿಸುತ್ತದೆ. ಇದು ಆರ್ಥಿಕ ಚಟುವಟಿಕೆಗಳಿಗೂ ಉತ್ತೇಜನ ನೀಡುತ್ತದೆ. https://t.co/MHBINZDT8m
Narendra Modi,1538837169896407040,2022-06-20 10:52:26+00:00,9214,2154,ಕರ್ನಾಟಕದಾದ್ಯಂತ ಅಡಚಣೆಯಿಲ್ಲದ ಸಂಪರ್ಕವನ್ನು ಒದಗಿಸಲು ಬದ್ಧವಾಗಿದ್ದೇವೆ. https://t.co/CYF3qUNFBM
Narendra Modi,1538837054548856832,2022-06-20 10:51:58+00:00,5336,1587,ಕಳೆದ 8 ವರ್ಷಗಳಲ್ಲಿ ಕರ್ನಾಟಕದಾದ್ಯಂತ ರೈಲ್ವೆ ಮೂಲಸೌಕರ್ಯವನ್ನು ಗಣನೀಯವಾಗಿ ಹೆಚ್ಚಿಸಲಾಗಿದೆ. ಇದರಿಂದ ಕೋಟ್ಯಂತರ ನಾಗರಿಕರಿಗೆ ಪ್ರಯೋಜನವಾಗುತ್ತಿದೆ. https://t.co/v6SBpMrV9G
Narendra Modi,1538836911317475328,2022-06-20 10:51:24+00:00,18954,4526,Committed to providing seamless connectivity across Karnataka. https://t.co/vtqGS03tig
Narendra Modi,1538835886057693184,2022-06-20 10:47:20+00:00,7968,2813,The Bengaluru Suburban Rail project will transform the city’s infrastructure. It will ensure comfortable and convenient travel for the dynamic people of Bengaluru. It will also boost economic activities. https://t.co/c1cbR7ZMML
Narendra Modi,1538835734995640322,2022-06-20 10:46:44+00:00,8278,2815,"In the last 8 years, railway infrastructure across Karnataka has been significantly enhanced. This is helping crores of citizens. https://t.co/Z5JDX3tCat"
Narendra Modi,1538834200199061504,2022-06-20 10:40:38+00:00,10746,2844,"Karnataka has a special contribution in India’s strides in the world of tech, research and innovation. In this context, the new Technology Hubs developed by transforming ITIs will provide skilling opportunities for the youth and create several employment opportunities. https://t.co/Q4CZHGoz1C"
Narendra Modi,1538834052895150080,2022-06-20 10:40:03+00:00,16339,3315,Dr. B R Ambedkar School of Economics (BASE) University is a tribute to the intellectual prowess of Dr. Ambedkar. The new campus of this institution will benefit several students. The new tech hubs which have been inaugurated will also be a boon for our Yuva Shakti. https://t.co/QWKUnp3pD0
Narendra Modi,1538826001777840128,2022-06-20 10:08:03+00:00,14132,3517,Delighted to be in Bengaluru. Speaking at a public meeting. https://t.co/epNMla6flf
Narendra Modi,1538800636644532225,2022-06-20 08:27:15+00:00,13167,3450,"At a time when every nation must give topmost importance to healthcare, efforts like the Bagchi Parthasarathy Multispeciality Hospital assume great importance. In the times to come, it will strengthen healthcare capacities and encourage pioneering research in the sector. https://t.co/BhFoPMoaUk"
Narendra Modi,1538798397045489666,2022-06-20 08:18:22+00:00,11057,3189,Glad to inaugurate the Centre for Brain Research at @iiscbangalore. The joy is greater because I also had the honour of laying the foundation stone for this project. This Centre will be at the forefront of research on how to manage brain related disorders. https://t.co/QU7Oe55s9w
Narendra Modi,1538731228798636032,2022-06-20 03:51:27+00:00,11475,2081,"ಕರ್ನಾಟಕ ರಾಜ್ಯಕ್ಕೆ ಹೋಗುತ್ತಿರುವೆ. ಅಲ್ಲಿ ಬೆಂಗಳೂರು ಮತ್ತು ಮೈಸೂರಿನ ಕಾರ್ಯಕ್ರಮ ಗಳಲ್ಲಿ ಭಾಗವಹಿಸುವೆ. ಮೊದಲ ಕಾರ್ಯಕ್ರಮ @iiscbangalore, ಅಲ್ಲಿ ಮಿದುಳು ಸಂಶೋಧನಾ ಕೇಂದ್ರ ಉದ್ಘಾಟಿಸಲಾಗುವುದು. ಬಾಗ್ಚಿ- ಪಾರ್ಥಸಾರಥಿ ಮಲ್ಟಿಸ್ಪೆಷಾಲಿಟಿ ಆಸ್ಪತ್ರೆಗಾಗಿ ಶಿಲಾನ್ಯಾಸ ನೆರವೇರಿಸಲಾಗುವುದು."
Narendra Modi,1538730675070816256,2022-06-20 03:49:15+00:00,20818,3584,"Leaving for Karnataka, where I will be attending programmes in Bengaluru and Mysuru. The first programme will be held at @iiscbangalore, where a Centre for Brain Research would be inaugurated. The foundation stone of the Bagchi-Parthasarathy Multispeciality Hospital will be laid."
Narendra Modi,1538729914568003586,2022-06-20 03:46:14+00:00,19177,4721,"कल यानि 21 जून को अंतर्राष्ट्रीय योग दिवस मनाया जाएगा। इस बार यह आयोजन ‘मानवता के लिए योग’ की थीम के तहत होगा। आइए, हम सब मिलकर इसे सफल बनाएं एवं योग की लोकप्रियता को और बढ़ाएं। https://t.co/UESTuNPNbW"
Narendra Modi,1538724035621801985,2022-06-20 03:22:52+00:00,3202,907,"ଆସନ୍ତା କାଲି, 21 ଜୁନ ଆନ୍ତର୍ଜାତୀୟ ଯୋଗ ଦିବସ ରୂପେ ପାଳିତ ହେବ । 'ମାନବତା ପାଇଁ ଯୋଗ' ଦ୍ୱାରା ଅନୁପ୍ରାଣିତ ହୋଇ, ଆସନ୍ତୁ ଯୋଗ ଦିବସକୁ ସଫଳ କରିବା ଏବଂ ଯୋଗକୁ ଆହୁରି ଲୋକପ୍ରିୟ କରିବା । https://t.co/UESTuNPNbW"
Narendra Modi,1538723966923177987,2022-06-20 03:22:36+00:00,5914,1590,"उद्या दि. २१ जून रोजी आंतरराष्ट्रीय योग दिन साजरा केला जाणार आहे.  यंदाच्या योग दिनाची संकल्पना ‘मानवतेसाठी योग’, ही आहे, चला योग दिन यशस्वीपणे साजरा करत, त्याचाअधिकाधिक प्रसार करूया. https://t.co/UESTuNPNbW"
Narendra Modi,1538723891803193344,2022-06-20 03:22:18+00:00,3089,885,"రేపు, జూన్ 21ని అంతర్జాతీయ యోగ దినోత్సవంగా జరపుకుంటున్నాం. ‘మానవత్వం కోసం యోగ’ అనే నేపథ్యంతో మార్గనిర్దేశం చేస్తూ, ఈ యోగ దినోత్సవాన్ని విజయవంతం చేసి, యోగను మరింత ప్రాచుర్యంలోకి తీసుకువ ద్దాం. https://t.co/UESTuNPNbW"
Narendra Modi,1538723823578755074,2022-06-20 03:22:02+00:00,4697,1676,"આવતીકાલે, 21 જૂન આંતરરાષ્ટ્રીય યોગ દિવસ તરીકે અંકિત થશે. 'માનવતા માટે યોગ' થીમથી માર્ગદર્શિત આ યોગ દિવસને ચાલો, સફળ બનાવીએ અને યોગને લોકપ્રિય બનાવીએ. https://t.co/UESTuNPNbW"
Narendra Modi,1538722659302682629,2022-06-20 03:17:24+00:00,3219,884,"কাইলৈ, ২১ জুন তাৰিখটো আন্তৰ্জাতিক যোগ দিৱস হিচাবে পালন কৰা হ'ব। 'মানৱতাৰ বাবে যোগ'ক মূল বিষয়বস্তু হিচাবে লৈ, আহক আমি এই যোগ দিৱসক সফল বনাওঁ আৰু যোগক অধিক জনপ্ৰিয় কৰো। https://t.co/UESTuNybNm"
Narendra Modi,1538722584950235136,2022-06-20 03:17:06+00:00,3330,971,"আগামীকাল 21শে জুন আন্তর্জাতিক যোগ দিবস রূপে উদযাপিত হবে । ' মানবতার জন্য যোগ ' এই ভাবনায় উদ্দীপ্ত হয়ে আসুন,  এবারের   যোগ দিবসকে সাফল্যমন্ডিত করে তুলি আর যোগাভ্যাসকে আরো জনপ্রিয় করে তুলি । https://t.co/UESTuNybNm"
Narendra Modi,1538722511151542272,2022-06-20 03:16:49+00:00,3735,1150,"நாளை, ஜூன் 21ஆம் நாள் சர்வதேச யோகா தினமாக கடைபிடிக்கப்படுகிறது. 'மனித சமூகத்திற்காக யோகா' என்ற கருத்தை பின்பற்றி, இந்த யோகா தினத்தை வெற்றியடைய செய்து, மேலும் யோகாவை பிரபலப்படுத்துவோம். https://t.co/UESTuNybNm"
Narendra Modi,1538722413801639936,2022-06-20 03:16:26+00:00,2813,818,നാളെ ജൂൺ 21 അന്താരാഷ്ട്ര യോഗാ ദിനമായി ആചരിക്കും. 'യോഗ മാനവികതയ്‌ക്ക്' എന്ന പ്രമേയത്തിലൂന്നിയ ഈ യോഗാ ദിനം നമുക്ക് വിജയകരമാക്കുകയും യോഗയെ കൂടുതൽ ജനകീയമാക്കുകയും ചെയ്യാം. https://t.co/UESTuNybNm
Narendra Modi,1538722327508054017,2022-06-20 03:16:05+00:00,2980,809,"ਕੱਲ੍ਹ, 21 ਜੂਨ ਅੰਤਰਰਾਸ਼ਟਰੀ ਯੋਗ ਦਿਵਸ ਵਜੋਂ ਮਨਾਇਆ ਜਾਵੇਗਾ। ‘ਮਾਨਵਤਾ ਦੇ ਲਈ ਯੋਗ’ ਦੇ ਥੀਮ ਤੋਂ ਸੇਧ ਲੈ ਕੇ, ਆਓ ਅਸੀਂ ਇਸ ਯੋਗ ਦਿਵਸ ਨੂੰ ਸਫ਼ਲ ਬਣਾਈਏ ਅਤੇ ਯੋਗ ਨੂੰ ਹੋਰ ਮਕਬੂਲ ਕਰੀਏ। https://t.co/UESTuNybNm"
Narendra Modi,1538722226899664896,2022-06-20 03:15:41+00:00,3896,964,"ನಾಳೆ, ಜೂನ್ 21ನ್ನು ಅಂತರರಾಷ್ಟ್ರೀಯ ಯೋಗ ದಿನವಾಗಿ ಆಚರಿಸಲಾಗುವುದು. 'ಮಾನವತೆಗಾಗಿ ಯೋಗ' ಈ ಬಾರಿಯ ಯೋಗದಿನದ ಧ್ಯೇಯವಾಗಿದ್ದು, ಈ ಯೋಗ ದಿನವನ್ನು ಯಶಸ್ವಿಯಾಗಿಸೋಣ ಮತ್ತು ಇನ್ನಷ್ಟು ಜನಪ್ರಿಯಗೊಳಿಸೋಣ. https://t.co/UESTuNQl1u"
Narendra Modi,1538722038348582912,2022-06-20 03:14:56+00:00,13658,3328,"Tomorrow, 21st June will be marked as International Yoga Day. Guided by the theme of ‘Yoga For Humanity’, let us make this Yoga Day a success and further popularise Yoga. https://t.co/UESTuNybNm"
Narendra Modi,1538495768801476608,2022-06-19 12:15:49+00:00,11828,3426,"At launch of torch relay for the 44th Chess Olympiad, I convey my best wishes to all the participants. https://t.co/uLbZ5JoSRr"
Narendra Modi,1538472013773254656,2022-06-19 10:41:26+00:00,21791,3805,"At around 5 PM, the torch relay for the 44th Chess Olympiad will be launched in Delhi. This is a special programme for a variety of reasons. It is for the first time that a Chess Olympiad Torch has been instituted. It is also the first time India is hosting this competition."
Narendra Modi,1538469609267134464,2022-06-19 10:31:52+00:00,32370,7566,मेरा एक सुझाव है… https://t.co/xs8xUP5BPT
Narendra Modi,1538469561112358913,2022-06-19 10:31:41+00:00,12315,3446,"पहली बार Urban Planning को कोई सरकार इतने बड़े स्तर पर महत्व दे रही है। शहरी गरीबों से लेकर शहरी मिडिल क्लास तक, हर किसी के लिए बेहतर सुविधाएं देने पर काम किया जा रहा है। https://t.co/o83AEhGToC"
Narendra Modi,1538469489989545989,2022-06-19 10:31:24+00:00,9283,3010,"आज दिल्ली को केंद्र सरकार की तरफ से आधुनिक इंफ्रास्ट्रक्चर का बहुत सुंदर उपहार मिला है।  ये हमारे इंजीनियरों, हमारे श्रमिक भाई-बहनों का कमाल है कि उन्होंने इस प्रोजेक्ट को तेजी से पूरा करके दिखाया है। https://t.co/dLMU41ruML"
Narendra Modi,1538402131958714370,2022-06-19 06:03:45+00:00,11559,3421,Pragati Maidan Integrated Transit Corridor will ensure ease of living by helping save time and cost of commuters in a big way. https://t.co/e98TMk3z0i
Narendra Modi,1538367358766841856,2022-06-19 03:45:34+00:00,30073,6070,"Sharing highlights from the special visit to Gujarat, where I addressed programmes in Pavagadh and Vadodara. https://t.co/jpp9dJoilI"
Narendra Modi,1538366012017344512,2022-06-19 03:40:13+00:00,5848,1990,Glad to have received several inputs for this month’s #MannKiBaat scheduled for the 26th. Do keep your ideas coming either on MyGov or the NaMo App. https://t.co/3KGfEqxtwv
Narendra Modi,1538365205033648128,2022-06-19 03:37:00+00:00,10843,2740,"आज के समय में योग का महत्त्व और अधिक हो जाता है, जब Non-communicable और Lifestyle से जुड़ी बीमारियां युवाओं में विशेष रूप से बढ़ रही हैं। इसलिए अच्छी सेहत और तंदुरुस्ती के लिए योग का अभ्यास अवश्य करें।   https://t.co/UESTuNQl1u"
Narendra Modi,1538364805177700352,2022-06-19 03:35:25+00:00,3478,924,"ಅಸಾಂಕ್ರಾಮಿಕ  ಮತ್ತು ಜೀವನ ಶೈಲಿಗೆ ಸಂಬಂಧಿಸಿದ ರೋಗಗಳು ಹೆಚ್ಚಾಗುತ್ತಿರುವ, ಅದರಲ್ಲಿಯೂ ಯುವ ವರ್ಗಗಳಲ್ಲಿ ಹೆಚ್ಚಾಗುತ್ತಿರುವ ಪ್ರಸ್ತುತ ಯುಗದಲ್ಲಿ  ಯೋಗದ ಪ್ರಾಮುಖ್ಯತೆ  ಹೆಚ್ಚು ಪ್ರಸ್ತುತವಾಗುತ್ತದೆ.  ಉತ್ತಮ  ಆರೋಗ್ಯ   ಮತ್ತು  ಸ್ವಸ್ಥತೆಗಾಗಿ  ಯೋಗಭ್ಯಾಸ  ಮಾಡಿರಿ. https://t.co/UESTuNybNm"
Narendra Modi,1538364697971286017,2022-06-19 03:35:00+00:00,3676,960,"నాన్-కమ్యూనికేబుల్ వ్యాధులు , జీవనశైలి సంబంధిత రుగ్మతలు పెరుగుతున్న ప్రస్తుత కాలంలో ముఖ్యంగా యువతలో యోగ యొక్క ప్రాముఖ్యత మరింత పెరిగింది. మంచి ఆరోగ్యం కోసం యోగ సాధన చేయండి. https://t.co/UESTuNybNm"
Narendra Modi,1538364624986177536,2022-06-19 03:34:42+00:00,2838,821,"ସାମ୍ପ୍ରତିକ ସମୟରେ, ବିଶେଷ କରି ଯୁବପିଢ଼ିଙ୍କ ମଧ୍ୟରେ ଅଣସଂକ୍ରାମକ ଏବଂ ଜୀବନଶୈଳୀ ସମ୍ବନ୍ଧୀୟ ଅସୁସ୍ଥତା ବୃଦ୍ଧି ପାଉଥିବା କାରଣରୁ ଯୋଗ ଆହୁରି ଅଧିକ ଗୁରୁତ୍ବପୂର୍ଣ୍ଣ ହୋଇପଡ଼ିଛି । ଉତ୍ତମ ସ୍ବାସ୍ଥ୍ୟ ଓ ଆରୋଗ୍ୟ ପାଇଁ ଯୋଗାଭ୍ୟାସ କରନ୍ତୁ । https://t.co/UESTuNybNm"
Narendra Modi,1538364503024205824,2022-06-19 03:34:13+00:00,3175,882,"বর্তমান যুগে  অ-সংক্রামক এবং জীবনশৈলীগত রোগ ক্রমশ বাড়ছে , বিশেষ করে তরুণদের মধ্যে , আর তাই, যোগা-র গুরুত্বও আরো বেশি হয়ে দাঁড়াচ্ছে । সুস্বাস্থ্য এবং ভালো থাকার জন্য যোগাভ্যাস করুন । https://t.co/UESTuNybNm"
Narendra Modi,1538364426197250048,2022-06-19 03:33:55+00:00,3346,985,"தொற்றா நோய்களும் வாழ்க்கை முறை சிக்கல்களால் ஏற்படும் உடல்நல சீர்கேடுகளும் , குறிப்பாக   இளம் வயதினரிடையே  பெருகி வரும் தற்காலச் சூழலில் ,  யோகா கூடுதல் முக்கியத்துவம் பெறுகிறது. சிறந்த ஆரோக்கியத்திற்கும் நலனுக்கும் யோகா பயிற்சியை மேற்கொள்ளுங்கள். https://t.co/UESTuNybNm"
Narendra Modi,1538364348573179904,2022-06-19 03:33:36+00:00,3207,877,বৰ্তমান যুগত বিশেষকৈ যুৱসকলৰ মাজত অসংক্ৰামক আৰু জীৱনশৈলী সম্পৰ্কীয় ৰোগ বৃদ্ধি পোৱাৰ ফলত  যোগৰ গুৰুত্ব আৰু অধিক হৈ পৰিছে।  সুস্বাস্থ্য আৰু সুস্থতাৰ বাবে যোগ অভ্যাস কৰক।  https://t.co/UESTuNybNm
Narendra Modi,1538364262673829889,2022-06-19 03:33:16+00:00,3858,1109,"सध्या योगाभ्यासाचं महत्व अधिकच वाढलं आहे कारण, सद्य परिस्थितीत विशेषतः युवा वर्गात  असंसर्गजन्य आणि जीवनशैलीशी निगडीत आजारांचं प्रमाण वाढलं आहे. तेव्हा चांगलं आरोग्य आणि कल्याणासाठी योगाभ्यास करत राहा.  https://t.co/UESTuNybNm"
Narendra Modi,1538364174647955457,2022-06-19 03:32:55+00:00,4002,1240,"વર્તમાન સમયમાં યોગનું મહત્વ વધી જાય છે, જ્યાં ખાસ કરીને યુવાઓમાં બિન ચેપી અને જીવનશૈલી આધારિત બીમારીઓ વધી રહી છે. સારા સ્વાસ્થ્ય અને સુખાકારી માટે યોગાભ્યાસ કરો.  https://t.co/UESTuNybNm"
