club,id,createdAt,favorites,retweets,text
Narendra Modi,1573520920597172225,2022-09-24 03:53:16+00:00,29608,5544,"Looking forward to being among our energetic Karyakartas at the @BJYM Yuva Vijay Sankalp Rally in Mandi, Himachal Pradesh today. The NDA government has undertaken various initiatives aimed at empowering our Yuva Shakti and ensuring they become self-reliant."
Narendra Modi,1573267001190948864,2022-09-23 11:04:17+00:00,23266,6999,The delay of Sardar Sarovar Project and the dubious role of urban Naxals in this delay has lessons for us all…  Let’s not jeopardise progress for self-interest of a select few. https://t.co/KxcUhUwbMx
Narendra Modi,1573266843900715008,2022-09-23 11:03:40+00:00,26472,5957,I don’t agree with the mindset that the Environment Ministry has to only be a regulator. This Ministry has a wide canvas of furthering innovative efforts to protect our surroundings. https://t.co/q12RSSXKzK
Narendra Modi,1573266604795695104,2022-09-23 11:02:43+00:00,20108,4754,India has shown how the economy can grow and at the same time ecology can flourish. https://t.co/Bvd2Q1P75I
Narendra Modi,1573178516551569410,2022-09-23 05:12:41+00:00,18939,5319,"Addressing the National Conference of Environment Ministers being held in Ekta Nagar, Gujarat. https://t.co/jo9e9OgeEB"
Narendra Modi,1572611751543476227,2022-09-21 15:40:33+00:00,19369,5183,The Cabinet decision on India's Logistics Policy will accelerate growth and increase our participation in global trade. Our efforts in the Logistics sector will particularly benefit our farmers and the MSME sector. https://t.co/NeiFaXh7ud
Narendra Modi,1572611710569295872,2022-09-21 15:40:24+00:00,15494,4284,Today's Cabinet decision on a PLI scheme relating to the National programme on High Efficiency Solar PV Modules will enhance manufacturing in the sector and boost investment. https://t.co/Xe1QXcfqW6
Narendra Modi,1572563411673952260,2022-09-21 12:28:28+00:00,29175,5348,"Glad to have received a copy of the Braille version of ‘Hemkosh’, which was among the earliest Assamese dictionaries dating back to the 19th century. I compliment Mr. Jayanta Baruah and his team for his efforts leading to the publication of the Braille version. https://t.co/OX7YtV1Koq"
Narendra Modi,1572563290819268615,2022-09-21 12:28:00+00:00,15081,2335,উনবিংশ শতিকাৰ অসমীয়া অভিধানসমূহৰ অন্যতম 'হেমকোষ'ৰ ব্ৰেইল সংস্কৰণৰ এটা প্ৰতিলিপি পাই আনন্দিত হৈছো। ব্ৰেইল সংস্কৰণ প্ৰকাশৰ বাবে শ্ৰীযুত জয়ন্ত বৰুৱা আৰু তেওঁৰ দলক এই প্ৰচেষ্টাৰ বাবে মই প্ৰশংসা জনাইছো। https://t.co/46R7d3zIY7
Narendra Modi,1572477221578629122,2022-09-21 06:45:59+00:00,185947,21386,"Raju Srivastava brightened our lives with laughter, humour and positivity. He leaves us too soon but he will continue to live in the hearts of countless people thanks to his rich work over the years. His demise is saddening. Condolences to his family and admirers. Om Shanti. https://t.co/U9UjGcfeBK"
Narendra Modi,1572270536629288960,2022-09-20 17:04:41+00:00,39592,6437,"काशी विद्वत्परिषद् के अध्यक्ष प्रो. रामयत्न शुक्ल जी का निधन शैक्षणिक, आध्यात्मिक और सांस्कृतिक जगत के लिए एक अपूरणीय क्षति है। उन्होंने संस्कृत भाषा और पारंपरिक शास्त्रों के संरक्षण में महत्वपूर्ण भूमिका निभाई। शोक की इस घड़ी में उनके परिजनों के प्रति मेरी संवेदनाएं। ओम शांति! https://t.co/76hcBKZKON"
Narendra Modi,1572204380635680768,2022-09-20 12:41:49+00:00,18250,4578,"For transforming our cities, behavioural changes are essential. https://t.co/DqJysRBgYr"
Narendra Modi,1572204335072948224,2022-09-20 12:41:38+00:00,10969,3498,Urban governance is about caring for the downtrodden and giving them a better quality of life. https://t.co/xpJrvCuWB4
Narendra Modi,1572204261290962945,2022-09-20 12:41:20+00:00,9002,3214,"Today, when regeneration of our cities is the need of the hour, the focus must move beyond an election centric approach to public welfare. https://t.co/6UZZBIO5mv"
Narendra Modi,1572204176968675333,2022-09-20 12:41:00+00:00,9356,3110,India’s urban landscape is changing for the better. https://t.co/nA2ZwI8Bb3
Narendra Modi,1572204076787703816,2022-09-20 12:40:36+00:00,8323,3057,"The conference of mayors, belonging to @BJP4India, is a great opportunity to share best practices with each other and focus on holistic living in our cities. https://t.co/S7VWm9j9nx"
Narendra Modi,1572091242334539779,2022-09-20 05:12:14+00:00,15624,4796,Addressing the @BJP4India Mayors' Conclave. https://t.co/UxEG3nmWNt
Narendra Modi,1571881495731527680,2022-09-19 15:18:47+00:00,31546,5964,"At 10:30 AM tomorrow, 20th September, will address a meeting of all the Mayors belonging to @BJP4India. With growing urbanisation, it is important that we view it as an opportunity and work together towards building modern, futuristic cities."
Narendra Modi,1571874598563504129,2022-09-19 14:51:22+00:00,20107,3992,"Had a fruitful meeting with DPM &amp; Finance Minister of Singapore @LawrenceWongST, Minister of Trade &amp; Industry Gan Kim Yong. Discussed ways to further boost bilateral ties between our countries, especially in emerging areas like digital connectivity, green hydrogen and Fintech. https://t.co/ZiCoBHKhF1"
Narendra Modi,1571873499781685248,2022-09-19 14:47:01+00:00,34152,5879,"Glad to have met a Sikh delegation. The members of the delegation were appreciative of the efforts our Government to fulfil aspirations of the dynamic Sikh community, which is synonymous with service and compassion. We are all inspired by the noble teachings of the great Gurus. https://t.co/PAXbi5k0wg"
Narendra Modi,1571873261796876291,2022-09-19 14:46:04+00:00,10731,2083,"ਸਿੱਖ ਵਫ਼ਦ ਨੂੰ ਮਿਲ ਕੇ ਖੁਸ਼ੀ ਹੋਈ। ਵਫ਼ਦ ਦੇ ਮੈਂਬਰਾਂ ਨੇ ਸੇਵਾ ਅਤੇ ਹਮਦਰਦੀ ਦੇ ਸਮਾਨਾਰਥੀ, ਗਤੀਸ਼ੀਲ ਸਿੱਖ ਭਾਈਚਾਰੇ ਦੀਆਂ ਆਕਾਂਖਿਆਵਾਂ ਨੂੰ ਪੂਰਾ ਕਰਨ ਲਈ ਸਾਡੀ ਸਰਕਾਰ ਦੇ ਯਤਨਾਂ ਦੀ ਸ਼ਲਾਘਾ ਕੀਤੀ। ਅਸੀਂ ਸਾਰੇ ਮਹਾਨ ਗੁਰੂਆਂ ਦੀਆਂ ਮਹਾਨ ਸਿੱਖਿਆਵਾਂ ਤੋਂ ਪ੍ਰੇਰਿਤ ਹਾਂ। https://t.co/2Djp8yZuV5"
Narendra Modi,1571791418498191360,2022-09-19 09:20:51+00:00,31346,5560,"Our wrestlers make us proud. Congrats to @Phogat_Vinesh and @BajrangPunia on their Bronze medal wins at the World Wrestling Championships, Belgrade. This is special for both as Vinesh becomes the 1st Indian woman to win 2 medals on this platform and Bajrang wins his 4th medal. https://t.co/atFe4Dbzov"
Narendra Modi,1571791196116365315,2022-09-19 09:19:58+00:00,25551,5128,समाज और राष्ट्रसेवा में समर्पित श्रीमद् पंचखण्ड पीठाधीश्वर आचार्य धर्मेंद्र जी के निधन से अत्यंत दुख हुआ है। उनका जाना धार्मिक और आध्यात्मिक जगत के लिए एक अपूरणीय क्षति है। ईश्वर उन्हें अपने श्रीचरणों में स्थान दे। ओम शांति!
Narendra Modi,1571772230513885185,2022-09-19 08:04:36+00:00,8285,1661,ଓଡ଼ିଶାର ପ୍ରଗତି ପାଇଁ ଶ୍ରୀ ବିଷ୍ଣୁଚରଣ ସେଠୀଙ୍କ ଅବଦାନ ଅତୁଳନୀୟ । ଜଣେ କଠିନ ପରିଶ୍ରମୀ ବିଧାୟକ ଭାବରେ ନିଜର ସ୍ୱତନ୍ତ୍ର ପରିଚୟ ସୃଷ୍ଟି କରିବା ସହ ସାମାଜିକ ସଶକ୍ତିକରଣ ପାଇଁ ତାଙ୍କ ଯୋଗଦାନ ପ୍ରଶଂସାଯୋଗ୍ୟ । ତାଙ୍କ ବିୟୋଗରେ ଦୁଃଖିତ । ତାଙ୍କ ପରିବାର ଏବଂ ସମର୍ଥକ ମାନଙ୍କୁ ସମବେଦନା । ଓଁ ଶାନ୍ତି
Narendra Modi,1571767164419608577,2022-09-19 07:44:28+00:00,19146,3987,Shri Bishnu Charan Sethi Ji made an outstanding contribution to Odisha's progress. He distinguished himself as a hardworking legislator and contributed greatly to social empowerment. Saddened by his demise. Condolences to his family and supporters. Om Shanti.
Narendra Modi,1571377412348448770,2022-09-18 05:55:44+00:00,38520,4550,"Thank you, Excellency @gantzbe! https://t.co/5MU960L5pE"
Narendra Modi,1571377302423879680,2022-09-18 05:55:18+00:00,16024,2571,"Thank you, Prime Minister @yairlapid for your kind wishes! https://t.co/LaVeEwPROO"
Narendra Modi,1571193368541102082,2022-09-17 17:44:25+00:00,19758,2856,Thank you President Azali Assoumani @Beit_Salam Salam for your wishes. https://t.co/lbwhzjSEB4
Narendra Modi,1571162318544965632,2022-09-17 15:41:02+00:00,38275,6145,"I spent the day attending programmes that cover our economy, society and the environment. I truly believe that when we collectively work on these spheres, we will fulfil our goal of sustainable and inclusive development. May we keep working harder and harder in the times to come."
Narendra Modi,1571162212190007298,2022-09-17 15:40:36+00:00,149646,17078,I am humbled by the affection received. I thank each and every person who has wished me on my birthday. These wishes give me strength to work even harder. I laud all those people who have devoted this day to various community service initiatives. Their resolve is commendable.
Narendra Modi,1571161962167533569,2022-09-17 15:39:37+00:00,23092,2899,"Touched by your wishes, Venkaiah Garu. @MVenkaiahNaidu https://t.co/9FtXg8JsNu"
Narendra Modi,1571161837747699712,2022-09-17 15:39:07+00:00,14497,1987,आपका हृदय से धन्यवाद माननीय @ramnathkovind जी। https://t.co/tX06iPMMmw
Narendra Modi,1571161644386099203,2022-09-17 15:38:21+00:00,10729,1697,Grateful to VP Jagdeep Dhankhar Ji for his wishes and kind words. @VPSecretariat https://t.co/SH9HiQ887Z
Narendra Modi,1571161404186701824,2022-09-17 15:37:24+00:00,14947,2042,शुभकामनाओं के लिए आपका बहुत-बहुत आभार माननीय राष्ट्रपति जी। @rashtrapatibhvn https://t.co/czbxm4AKzH
Narendra Modi,1571161121532547072,2022-09-17 15:36:16+00:00,47277,7836,An unforgettable day in Madhya Pradesh! https://t.co/ius7WxTlDN
Narendra Modi,1571160831202824192,2022-09-17 15:35:07+00:00,10674,1729,Thank You @PMBhutan for your warm wishes. I truly value the immense love and respect I have always received from my friends in Bhutan. https://t.co/f3WnTS2rrz
Narendra Modi,1571160687883460610,2022-09-17 15:34:33+00:00,8843,1514,Thank you my dear friend PM @KumarJugnauth for the wishes. https://t.co/LWjHyJqzEr
Narendra Modi,1571160566361894914,2022-09-17 15:34:04+00:00,9585,1562,Thank you Prime Minister @SherBDeuba for your warm birthday wishes. I am deeply touched. https://t.co/72hQrlkDGw
Narendra Modi,1571160424174985217,2022-09-17 15:33:30+00:00,11994,1731,Thank you Prime Minister @SkerritR for your birthday greetings. https://t.co/IKIrMwiyem
Narendra Modi,1571150696292163589,2022-09-17 14:54:51+00:00,28387,5932,"The journey towards sustainable development, protecting our flora and fauna is incomplete without community participation. In Madhya Pradesh earlier today, interacted with Cheetah Mitras, who will surely do excellent work. https://t.co/eIVCxeZj7A"
Narendra Modi,1571150054119055360,2022-09-17 14:52:18+00:00,11289,2780,Here is how the National Logistics Policy and PM-Gati Shakti will support each other. https://t.co/ZVn843wTox
Narendra Modi,1571149992731250688,2022-09-17 14:52:03+00:00,11377,2696,Our National Logistics Policy augurs well for many sectors. https://t.co/h6CkO5Koy4
Narendra Modi,1571149929980252161,2022-09-17 14:51:48+00:00,9381,2638,A National Logistics Policy is the need of the hour. https://t.co/uyTM8JIi9a
Narendra Modi,1571149801965907975,2022-09-17 14:51:17+00:00,16207,3355,"Today India became home to Cheetahs, an animal synonymous with speed. The National Logistics Policy launched today will give speed to India’s development journey.   A sound policy with top level performance will enhance India’s progress. https://t.co/F59RRExABo"
Narendra Modi,1571118511086522368,2022-09-17 12:46:57+00:00,13508,3717,National Logistics Policy is a comprehensive effort to enhance efficiency of the logistics ecosystem in India. https://t.co/70ZlTMQILp
Narendra Modi,1571103845937201155,2022-09-17 11:48:41+00:00,16762,3824,मुझे खुशी है कि सरकार के प्रयासों के कारण आज घर के आर्थिक फैसलों में महिलाओं की भूमिका बढ़ रही है। https://t.co/rciUe25JKK
Narendra Modi,1571103727951519745,2022-09-17 11:48:13+00:00,13915,3406,मैं इसीलिए स्वयं सहायता समूहों को राष्ट्र सहायता समूह कहता हूं… https://t.co/XLxE2VDzyO
Narendra Modi,1571103653825593345,2022-09-17 11:47:55+00:00,16684,3516,A special welcome for the Cheetahs. https://t.co/16DbciBeL8
Narendra Modi,1571103580626599937,2022-09-17 11:47:37+00:00,38535,6856,"जन्मदिन पर मैं आज मां के पास तो नहीं जा सका, लेकिन उनको यह देखकर जरूर संतोष होगा कि मध्य प्रदेश की लाखों माताओं का आशीर्वाद मुझे मिल रहा है। https://t.co/mVFkpPCxSC"
Narendra Modi,1571078136456183808,2022-09-17 10:06:31+00:00,11637,3477,Addressing Kaushal Dikshant Samaroh of ITI. https://t.co/YOkK76UwGw
Narendra Modi,1571062400782311433,2022-09-17 09:03:59+00:00,27881,4468,"On the special occasion of Vishwakarma Jayanti, I have the honour of speaking at the Kaushal Deekshant Samaroh, a unique programme which celebrates the industrious efforts of all those who toil hard for India's progress. Watch my remarks at around 3:30 PM."
Narendra Modi,1571061844110090240,2022-09-17 09:01:47+00:00,13979,3524,India has shown how a perfect balance between economy and ecology can be achieved. https://t.co/4A47M0LiIb
Narendra Modi,1571061776133009410,2022-09-17 09:01:31+00:00,23113,4669,The Cheetahs are here but… https://t.co/AOja89qdSB
Narendra Modi,1571061687654182913,2022-09-17 09:01:09+00:00,134053,16868,"A long wait is over, the Cheetahs have a home in India at the Kuno National Park. https://t.co/8FqZAOi62F"
Narendra Modi,1571046615452119041,2022-09-17 08:01:16+00:00,15586,4552,मध्य प्रदेश के श्योपुर में 'स्वयं सहायता समूह सम्मेलन' में लोगों के स्नेह से अभिभूत हूं। https://t.co/SrCMkZWKJn
Narendra Modi,1571020042346831872,2022-09-17 06:15:40+00:00,30108,7732,Project Cheetah is our endeavour towards environment and wildlife conservation. https://t.co/ZWnf3HqKfi
Narendra Modi,1570959215375822848,2022-09-17 02:13:58+00:00,90020,15417,देशवासियों को भगवान विश्वकर्मा जयंती की अनंत शुभकामनाएं। इस अवसर पर नवनिर्माण और नवसृजन के साथ ही सभी प्रकार के रचनात्मक कार्यों से जुड़े कर्मयोगियों का मेरा हार्दिक अभिनंदन। आपका कौशल और कर्तव्यभाव अमृतकाल में देश को नई ऊंचाइयों पर ले जाने वाला है। https://t.co/fW6pLUwNdj
Narendra Modi,1570820771320332289,2022-09-16 17:03:50+00:00,22581,5257,देश में वन्यजीवों के संरक्षण के प्रयासों को कल एक नई ताकत मिलेगी। नामीबिया से लाए जा रहे चीतों को करीब 10:45 बजे मध्य प्रदेश के कुनो राष्ट्रीय उद्यान में छोड़ने का सुअवसर मिलेगा। इसके बाद दोपहर करीब 12 बजे श्योपुर में आयोजित एसएचजी सम्मेलन में भाग लूंगा।  https://t.co/45CNIWgrZg
Narendra Modi,1570819074611093505,2022-09-16 16:57:06+00:00,33960,4861,Had productive multilateral and bilateral engagements at the SCO Summit. I thank the people and Government of Uzbekistan for their hospitality.
Narendra Modi,1570819032965840897,2022-09-16 16:56:56+00:00,19574,2835,ShHT sammitida samarali ikki va ko'p tomonlama uchrashuvlar olib bordik. O‘zbekiston xalqi va hukumatiga mehmondo‘stlik uchun  minnatdorchilik bildiraman.
Narendra Modi,1570814939723608064,2022-09-16 16:40:40+00:00,41376,3513,با رئیس جمهور ابراهیم رئیسی درباره طیف وسیعی از موضوعات گفتگو نمودم. ما در مورد دوستی رو به رشد هند و ایران و دامنه تقویت روابط در بخش هایی مانند انرژی، تجارت و مسیر های مواصلاتی مذاکره داشتیم. https://t.co/A6tcIe8wad
Narendra Modi,1570813981010591746,2022-09-16 16:36:52+00:00,30290,4145,"Held wide-ranging discussions with President Ebrahim Raisi. We talked about the growing India-Iran friendship and the scope to boost ties in sectors like energy, commerce and connectivity. https://t.co/jrGI6ut7kM"
Narendra Modi,1570787704501305345,2022-09-16 14:52:27+00:00,22383,4175,"Had a great meeting with President Shavkat Mirziyoyev. Thanked him for hosting the SCO Summit. Discussed ways to deepen connectivity, trade and cultural cooperation between India and Uzbekistan. https://t.co/64HZz6enrX"
Narendra Modi,1570787273008087041,2022-09-16 14:50:44+00:00,12572,2437,"Prezident Shavkat Mirziyoyev bilan ajoyib uchrashuv bo'ldi.  ShHT sammitiga mezbonlik qilgani uchun minnatdorchilik bildirib o'tdim.  Hindiston va O‘zbekiston o‘rtasidagi aloqalarni, savdo va madaniy hamkorlikni chuqurlashtirish yo‘llarini muhokama qildik. https://t.co/YrAfE8TFWg"
Narendra Modi,1570776789936640000,2022-09-16 14:09:04+00:00,87177,11995,"Had a wonderful meeting with President Putin. We got the opportunity to discuss furthering India-Russia cooperation in sectors such as trade, energy, defence and more. We also discussed other bilateral and global issues. https://t.co/iHW5jkKOW0"
Narendra Modi,1570776080478539781,2022-09-16 14:06:15+00:00,32617,4397,"Провел замечательную встречу с Президентом Путиным. У нас была возможность обсудить дальнейшее сотрудничество России и Индии в торговле, энергетике, обороне и других сферах. Также мы обсудили отношения между нашими странами и глобальные вопросы. https://t.co/iz63vADW4a"
Narendra Modi,1570745125030207488,2022-09-16 12:03:15+00:00,23773,4367,Met President @RTErdogan and reviewed the full range of bilateral relations between India and Turkey including ways to deepen economic linkages for the benefit of our people. @trpresidency https://t.co/wwNe1KrMCm
Narendra Modi,1570744735098359814,2022-09-16 12:01:42+00:00,17031,2898,Cumhurbaşkanı @RTErdogan ile görüştük ve halklarımızın menfaati için ekonomik ilişkileri derinleştirecek yollar dahil Hindistan ve Türkiye arasındaki tüm ikili ilişkileri gözden geçirdik. https://t.co/959rwatEFG
Narendra Modi,1570690289622458370,2022-09-16 08:25:21+00:00,27103,6005,"At the SCO Summit in Samarkand, emphasised on the constructive role SCO can play in the post-COVID era particularly in furthering economic recovery and strengthening supply chains. Highlighted India’s emphasis on people-centric growth which also gives importance to technology. https://t.co/kwF5bDESkR"
Narendra Modi,1570687339713929217,2022-09-16 08:13:38+00:00,85527,10238,With SCO leaders at the Summit in Samarkand. https://t.co/nBQxx8IVEe
Narendra Modi,1570678384468062210,2022-09-16 07:38:03+00:00,19818,5857,My remarks at the SCO Summit in Samarkand. https://t.co/6f42ycVLzq
Narendra Modi,1570616534598557698,2022-09-16 03:32:17+00:00,27617,4281,Birthday wishes to Uttarakhand CM Shri @pushkardhami. He is at the forefront of many efforts to transform Uttarakhand and empower the people of the state. May he lead a long and healthy life in service of the people.
Narendra Modi,1570449939398029317,2022-09-15 16:30:17+00:00,63455,8498,Landed in Samarkand to take part in the SCO Summit. https://t.co/xaZ0pkjHD1
Narendra Modi,1570449728403570688,2022-09-15 16:29:27+00:00,24907,4213,ShHT sammitida ishtirok etish uchun Samarqandga qo‘ndik. https://t.co/KX3IJWuDgX
Narendra Modi,1570401405978169346,2022-09-15 13:17:26+00:00,26266,4929,"Leaving for Samarkand, Uzbekistan to attend the SCO Summit, which will witness exchange of views on a wide range of regional and global issues. https://t.co/pmA3n8JsKQ"
Narendra Modi,1570345480701485058,2022-09-15 09:35:12+00:00,16042,3428,Congratulations to H.E. Joao Manuel Goncalves Lourenco @jlprdeangola on being re-elected as the President of Angola. I look forward to working closely together for strengthening our bilateral relations.
Narendra Modi,1570273732522045441,2022-09-15 04:50:06+00:00,21677,4020,"Saddened by the passing away of Tun Dr. S. Samy Vellu, Former Cabinet Minister of Malaysia and the first Pravasi Bharatiya Samman Awardee from Malaysia. Heartfelt condolences to his family. Om Shanti. https://t.co/RkFRSCOTtW"
Narendra Modi,1570243233309134848,2022-09-15 02:48:55+00:00,17495,4708,"On #EngineersDay, we remember the pathbreaking contribution of Sir M. Visvesvaraya. May he keep inspiring generations of future engineers to distinguish themselves. I am also sharing a snippet from one of the previous #MannKiBaat programmes where I talked about this subject. https://t.co/2Vj3bHxVQS"
Narendra Modi,1570242695410626560,2022-09-15 02:46:46+00:00,45624,7567,Greetings to all engineers on #EngineersDay. Our nation is blessed to have a skilled and talented pool of engineers who are contributing to nation building. Our Government is working to enhance infrastructure for studying engineering including building more engineering colleges.
Narendra Modi,1570095108183429130,2022-09-14 17:00:19+00:00,21089,4064,Shri Naresh Kumar will be remembered for his pioneering contribution to Indian sports. He played a major role in popularising tennis. In addition to being a great player he was also an exceptional mentor. Pained by his demise. Condolences to his family and friends. Om Shanti.
Narendra Modi,1570084728187023363,2022-09-14 16:19:04+00:00,30725,4660,"Happy to have met French Minister for Europe and Foreign Affairs @MinColonna today. We discussed cooperation on bilateral, regional and global issues. Conveyed warm regards for my friend @EmmanuelMacron. https://t.co/W1yJESAE0u"
Narendra Modi,1570022189323399170,2022-09-14 12:10:34+00:00,30844,5578,Had a warm meeting with His Majesty the King of Bhutan. Discussed various ideas to further strengthen the close and unique India-Bhutan friendship. Conveyed my appreciation for the guiding vision provided by successive Druk Gyalpos in shaping our relations. https://t.co/cmWW41lFrK
Narendra Modi,1569937879673217025,2022-09-14 06:35:33+00:00,22841,4355,"श्रीमंत छत्रपती शिवाजीराजे भोसले यांच्या निधनाने वृत्त दु:खदायक आहे. ते सदैव कार्यरत, अष्टपैलू व्यक्तिमत्व  होते, लोकसेवेबरोबरच साताऱ्याच्या विकासात त्यांचे मोठे योगदान होते. त्यांचे कुटुंबीय आणि चाहत्यांप्रति मी माझ्या संवेदना व्यक्त करतो.ओम शांती."
Narendra Modi,1569891849145548802,2022-09-14 03:32:38+00:00,56465,11163,"हिन्दी ने विश्वभर में भारत को एक विशिष्ट सम्मान दिलाया है। इसकी सरलता, सहजता और संवेदनशीलता हमेशा आकर्षित करती है। हिन्दी दिवस पर मैं उन सभी लोगों का हृदय से अभिनंदन करता हूं, जिन्होंने इसे समृद्ध और सशक्त बनाने में अपना अथक योगदान दिया है।"
