club,id,createdAt,favorites,retweets,text
Narendra Modi,1600899736227049473,2022-12-08 17:06:55+00:00,6482,1695,"भाजपा के राजनीतिक जीवन में उतार-चढ़ाव चाहे कितने भी आए हों, लेकिन हम हमेशा आदर्शों और मूल्यों पर अडिग रहे हैं। https://t.co/2SigffiTCH"
Narendra Modi,1600899687510265856,2022-12-08 17:06:43+00:00,4029,1197,गुजरात के नतीजों ने यह सिद्ध किया है कि भाजपा ही भरोसे का दूसरा नाम है। https://t.co/h0NVp9m0TD
Narendra Modi,1600899615183675392,2022-12-08 17:06:26+00:00,3420,1084,युवाओं ने भारी संख्या में भाजपा को वोट देकर यह जता दिया है कि वे ना तो जातिवाद के बहकावे में आने वाले हैं और ना ही परिवारवाद के। उनका दिल सिर्फ विजन और विकास से ही जीता जा सकता है और भाजपा की राजनीति इन दोनों पर ही आधारित है। https://t.co/uwMftrSfS5
Narendra Modi,1600899548515225600,2022-12-08 17:06:10+00:00,3725,1095,"गुजरात, हिमाचल और दिल्ली की जनता-जनार्दन का बहुत-बहुत आभार। भाजपा को मिला जन-समर्थन… नए भारत की आकांक्षाओं का प्रतिबिंब है। भारत के युवाओं की सोच का प्रकटीकरण है। गरीब, दलित, वंचित, पिछड़े, आदिवासियों के सशक्तिकरण के लिए है। https://t.co/mDYCSxUK3Z"
Narendra Modi,1600847919992942594,2022-12-08 13:41:01+00:00,11866,3517,Speaking at the @BJP4India HQ in Delhi. https://t.co/1617VCfIdx
Narendra Modi,1600815759269466113,2022-12-08 11:33:13+00:00,13549,2050,Birthday wishes to Shri Parkash Singh Badal Sahab. He is widely respected for his contribution to Punjab’s progress. May he be blessed with a long and healthy life.
Narendra Modi,1600815477919748096,2022-12-08 11:32:06+00:00,38251,5092,I thank the people of Himachal Pradesh for the affection and support for the BJP. We will keep working to fulfil the aspirations of the state and raise people’s issues in the times to come. @BJP4Himachal
Narendra Modi,1600814845347377153,2022-12-08 11:29:35+00:00,28687,5580,"To all hardworking @BJP4Gujarat Karyakartas I want to say - each of you is a champion! This historic win would never be possible without the exceptional hardwork of our Karyakartas, who are the real strength of our Party."
Narendra Modi,1600814580401590274,2022-12-08 11:28:32+00:00,90500,14197,Thank you Gujarat. I am overcome with a lot of emotions seeing the phenomenal election results. People blessed politics of development and at the same time expressed a desire that they want this momentum to continue at a greater pace. I bow to Gujarat’s Jan Shakti.
Narendra Modi,1600448778129272832,2022-12-07 11:14:58+00:00,50504,7264,"Today, on Armed Forces Flag Day, we salute the valour and sacrifices of our armed forces. Since decades, they are at the forefront of protecting our nation and contributing to a stronger India. I also urge you all to contribute to the Armed Forces Flag Day Fund. https://t.co/8iryakJdJZ"
Narendra Modi,1600362674612674565,2022-12-07 05:32:49+00:00,20567,5727,Speaking in the Rajya Sabha. https://t.co/1sMsERCMzU
Narendra Modi,1600352686531977216,2022-12-07 04:53:08+00:00,20509,5222,May the Winter Session of Parliament be a productive one. https://t.co/uYJvkP5nCj
Narendra Modi,1600133828651388929,2022-12-06 14:23:28+00:00,18798,3584,"Professor YK Alagh was a distinguished scholar who was passionate about various aspects of public policy, particularly rural development, the environment and economics. Pained by his demise. I will cherish our interactions. My thoughts are with his family and friends. Om Shanti."
Narendra Modi,1599972270671564800,2022-12-06 03:41:30+00:00,38579,6414,"On Mahaparinirvan Diwas, I pay homage to Dr. Babasaheb Ambedkar and recall his exemplary service to our nation. His struggles gave hope to millions and his efforts to give India such an extensive Constitution can never be forgotten. https://t.co/WpCjx0cz7b"
Narendra Modi,1599813358613827586,2022-12-05 17:10:02+00:00,32558,5832,The All-Party meet on India's G-20 Presidency was a productive one. I thank all leaders who participated in the meeting and shared their insights. This Presidency belongs to the entire nation and will give us the opportunity to showcase our culture. https://t.co/wMaI0iSU8R https://t.co/JVB9fEzGXm
Narendra Modi,1599620971711037441,2022-12-05 04:25:33+00:00,117439,11752,આજે મેં અમદાવાદ ખાતે મતદાન કર્યું. https://t.co/pcp11w7RjV
Narendra Modi,1599620347053375488,2022-12-05 04:23:04+00:00,77433,9857,Cast my vote in Ahmedabad. Urging all those voting today to turnout in record numbers and vote. https://t.co/m0X16uCtjA
Narendra Modi,1599587320293752832,2022-12-05 02:11:50+00:00,21146,3768,There are also by-polls taking place in different parts of India. I urge those whose seats are witnessing these by-polls to turnout in large numbers and vote.
Narendra Modi,1599587032103522304,2022-12-05 02:10:42+00:00,11044,2715,"ગુજરાત વિધાનસભાની ચૂંટણીના બીજા તબક્કાના મતદાનમાં સૌ નાગરિકોને, ખાસ કરીને યુવા તેમજ મહિલા મતદારોને, અચૂક મતદાન કરવા માટે અનુરોધ કરું છું.   હું સવારે 9 વાગ્યે અમદાવાદમાં મારો મત આપીશ."
Narendra Modi,1599586940763840512,2022-12-05 02:10:20+00:00,21333,3926,"Urging all those who are voting in Phase 2 of the Gujarat elections, particularly the young voters and women voters to vote in large numbers. I will be casting my vote in Ahmedabad at around 9 AM."
Narendra Modi,1599453538555662336,2022-12-04 17:20:14+00:00,40119,5380,Thank you @POTUS. Your valued support will be a source of strength for India’s G-20 Presidency. It is important we all work together to build a better planet. https://t.co/FbGQ3WHCza
Narendra Modi,1599453417021526016,2022-12-04 17:19:45+00:00,8577,1910,Thank you Mr. @CharlesMichel. Looking forward to your active participation as we collectively work towards furthering global good. https://t.co/xWxYc34eYG
Narendra Modi,1599453260926320640,2022-12-04 17:19:08+00:00,7928,1816,Gratitude for your kind works Mr. @sanchezcastejon. Fully endorse your views on collectively working to mitigate challenges of the present to leave a better planet for the coming generations. https://t.co/iSadfoJAJM
Narendra Modi,1599453126456934400,2022-12-04 17:18:36+00:00,14682,2329,Your solidarity is vital. Japan has contributed a lot to global well-being and I am confident the world will continue to learn from Japan’s successes on various fronts. @kishida230 https://t.co/xQtFgoQe5e
Narendra Modi,1599452891907256327,2022-12-04 17:17:40+00:00,28620,3835,"Thank you, my dear friend @EmmanuelMacron! I look forward to consulting you closely during India's G20 Presidency, as we work to focus the world's attention on the issues that affect humanity as a whole. https://t.co/nolvLwuYln"
Narendra Modi,1599237294254616576,2022-12-04 03:00:57+00:00,49276,9018,Best wishes on Navy Day to all navy personnel and their families. We in India are proud of our rich maritime history. The Indian Navy has steadfastly protected our nation and has distinguished itself with its humanitarian spirit during challenging times. https://t.co/nGxoWxVLaz
Narendra Modi,1599002327075078147,2022-12-03 11:27:17+00:00,23062,5265,"Over the last few days, I’ve travelled across the length and breadth of Gujarat. Wherever I went, I have received tremendous affection. People have seen the development in the last two decades and want this trajectory to continue. https://t.co/qs7Z3a7Z5e"
Narendra Modi,1599002006445649921,2022-12-03 11:26:01+00:00,11180,3209,છેલ્લા કેટલાક દિવસોમાં મેં સમગ્ર ગુજરાતનો પ્રવાસ કર્યો. હું જ્યાં જયાં ગયો ત્યાં મને જનતા જનાર્દનનો અપાર સ્નેહ મળ્યો. ગુજરાતના લોકો છેલ્લા બે દાયકામાં રાજ્યએ કરેલી પ્રગતિના સાક્ષી છે અને તેઓ ઈચ્છે છે કે આ વિકાસયાત્રા અવિરત ચાલુ રહે. https://t.co/0z410jyW8y
Narendra Modi,1598933415348568066,2022-12-03 06:53:27+00:00,26183,6311,भारतामृत सर्वस्वं विष्णोर्वक्त्राद्विनिः सृतम्। गीता गंगोदकं पीत्वा पुनर्जन्म न विद्यते।।  सभी देशवासियों को गीता जयंती की अनंत शुभकामनाएं। श्रीमद्भगवद्गीता सदियों से मानवता का मार्गदर्शन करती आई है। अध्यात्म और जीवन-दर्शन से जुड़ा यह महान ग्रंथ हर युग में पथ प्रदर्शक बना रहेगा।
Narendra Modi,1598879733374414848,2022-12-03 03:20:08+00:00,23229,3961,"Remembering Dr. Rajendra Prasad Ji on his birth anniversary. A legendary leader, he epitomised courage and scholarly zeal. He was firmly rooted in India’s culture and also had a futuristic vision for India’s growth."
Narendra Modi,1598879124160122881,2022-12-03 03:17:43+00:00,14764,3227,"On International Day of Persons with Disabilities, I laud the fortitude and accomplishments of our Divyang sisters and brothers. Our Government has undertaken numerous initiatives which have created opportunities for persons with disabilities and enabled them to shine."
Narendra Modi,1598714938318794752,2022-12-02 16:25:18+00:00,81198,8420,Prayed at the Nagardevi Maa Bhadrakali Mandir in Ahmedabad. https://t.co/HDcVnA34XV
Narendra Modi,1598712383739789312,2022-12-02 16:15:09+00:00,7514,2238,કોંગ્રેસ સરકારોની અણઘડ નીતિના કારણે અને શુદ્ધ નિયતના અભાવે દેશમાં અમીરી અને ગરીબી વચ્ચેની ખાઈ ખૂબ પહોળી થઈ ગઈ. ભાજપ સરકારે લોકાભિમુખ વહિવટ આપી ગરીબો અને વંચિતોના જીવન ધોરણમાં સુધારો કર્યો છે….. https://t.co/vIHXXvyp6Q
Narendra Modi,1598705838591741953,2022-12-02 15:49:09+00:00,22303,4896,"Unparalleled affection, which strengthens my resolve to serve the people even more!   Highlights from Ahmedabad a short while ago. https://t.co/OvAhA3Dgs2"
Narendra Modi,1598705311912644608,2022-12-02 15:47:03+00:00,5993,2016,આણંદ એ પ્રેરણાભૂમિ છે…આણંદ એ સંકલ્પોની ભૂમિ છે….આ ભૂમિ એ “એક ભારત - શ્રેષ્ઠ ભારત” ના પ્રણેતા સરદાર પટેલની ભૂમિ છે. હું ગૌરવ અનુભવું છું કે વિશ્વની સૌથી ઊંચી પ્રતિમા “સ્ટેચ્યુ ઓફ યુનિટી”નું નિર્માણ કરાવી સરદાર સાહેબને સ્મરણાંજલિ આપવાનું સૌભાગ્ય મને પ્રાપ્ત થયું છે. https://t.co/b4Xi3cAY2t
Narendra Modi,1598704909313900544,2022-12-02 15:45:27+00:00,6354,1840,બે દાયકાની કઠોર તપશ્ચર્યા અને એની ફલશ્રુતિના કારણે ભારતીય જનતા પાર્ટી એ ભરોસાનું પ્રતિક બની ગઈ છે. ભાજપ એટલે ભરોસો….અને ભરોસો એટલે ભાજપ….. https://t.co/sN8MmTSMXU
Narendra Modi,1598704262371889154,2022-12-02 15:42:53+00:00,9561,2557,"During Congress rule, there was rampant corruption and mismanagement on urea. We changed this. https://t.co/Sl27uXsPzk"
Narendra Modi,1598704187495223296,2022-12-02 15:42:35+00:00,7202,2077,The @BJP4Gujarat Government has solved people’s problems and empowered our citizens. https://t.co/uP1fKoxCBA
Narendra Modi,1598704108449341440,2022-12-02 15:42:16+00:00,7990,2362,Blots of Congress include:  Denying water to Gujarat for decades.  Stalling Sardar Sarovar project.  Closely associating with those who did not want Narmada Dam. https://t.co/LAPfGDQl3p
Narendra Modi,1598681058756599808,2022-12-02 14:10:41+00:00,11096,3010,Lively atmosphere in Ahmedabad. The mood is overwhelmingly in favour of BJP across Gujarat. https://t.co/SD4kPy1ltg
Narendra Modi,1598635787100164096,2022-12-02 11:10:47+00:00,41365,7148,Have you come across breathtaking images from the recently launched EOS-06 satellite? Sharing some beautiful images of Gujarat. These advances in the world of space technology will help us to better predict cyclones and promote our coastal economy too. @isro https://t.co/JD6eu7JzOK
Narendra Modi,1598623288657600512,2022-12-02 10:21:07+00:00,8289,2543,Speaking at a rally in Sojitra. People of Gujarat have seen the pioneering work of @BJP4Gujarat. https://t.co/DUST3syM2P
Narendra Modi,1598596477751767042,2022-12-02 08:34:35+00:00,10159,2886,Coming to Patan is always special. Addressing a massive rally. Watch. https://t.co/V4QJZoEOhS
Narendra Modi,1598574423698612226,2022-12-02 07:06:57+00:00,8909,2733,The energy and dynamism in Kankrej is phenomenal. Speaking at a @BJP4Gujarat rally. https://t.co/1cXkHJYwOt
Narendra Modi,1598539394654560258,2022-12-02 04:47:45+00:00,37562,7425,Yesterday was special.   Words cannot describe the love and affection I received from people.  Sharing highlights from Ahmedabad. https://t.co/87Vtgbloa4
Narendra Modi,1598516141827428352,2022-12-02 03:15:21+00:00,22438,4525,भारतीय जनता पार्टी के राष्ट्रीय अध्यक्ष जेपी नड्डा जी को जन्मदिन की ढेरों शुभकामनाएं। उन्होंने अपनी नेतृत्व क्षमता से भाजपा में नया जोश और नई ऊर्जा भरने का काम किया है।ईश्वर उन्हें दीर्घायु और आरोग्यपूर्ण जीवन प्रदान करे। @JPNadda
Narendra Modi,1598366964514230287,2022-12-01 17:22:35+00:00,51903,7549,Thank you Ahmedabad! https://t.co/0mmFZBrnCY
Narendra Modi,1598365381676220419,2022-12-01 17:16:17+00:00,13597,3277,ધન્યવાદ અમદાવાદ…..!!   આપના અપાર સ્નેહ અને ઉત્સાહથી હું અભિભૂત થયો છું. આ પ્રચંડ જન સમર્થન અમને લોકકલ્યાણ અર્થે વધુ પરિશ્રમ કરવા માટે પ્રેરણા આપે છે.   ખૂબ ખૂબ આભાર…!! https://t.co/wrUr4gBntE
Narendra Modi,1598272705911959552,2022-12-01 11:08:02+00:00,7550,2452,"આ દેશને આત્મનિર્ભર બનાવવાની દિશામાં આપણે  “વન ડિસ્ટ્રીક્ટ - વન પ્રોડક્ટ” અભિયાન શરૂ કર્યું છે જે અંતર્ગત આપણા ગુજરાતના કૌશલ્ય, હસ્તશિલ્પ અને કુટિર ઉદ્યોગને વૈશ્વિક ફલક પર પ્રોત્સાહન મળે તેવા પ્રામાણિક પ્રયત્ન થઈ રહ્યા છે. https://t.co/zD4js7iXRe"
Narendra Modi,1598272613242966016,2022-12-01 11:07:40+00:00,7091,2372,"ભાજપ સરકારે સર્વસ્પર્શી અને સર્વસમાવેશી વહીવટી નીતિ અખત્યાર કરી છે. અંબાજી થી ઉમરગામ સુધીના આદિવાસી પટ્ટામાં છેલ્લા બે દાયકામાં શિક્ષણ, આરોગ્ય, રમતગમત તથા રોજગાર ક્ષેત્રના વિકાસ માટે પ્રમાણભૂત પ્રયાસો કર્યા છે….. https://t.co/adXJYsW4HJ"
Narendra Modi,1598272512722227200,2022-12-01 11:07:16+00:00,7489,2439,"કોંગ્રેસ પક્ષના નેતાઓએ હંમેશાં આપણી શ્રદ્ધા, આસ્થા અને જનભાવનાને ગંભીર રીતે આહત કરી છે….. https://t.co/DVyW3jdY1j"
Narendra Modi,1598272411014557696,2022-12-01 11:06:51+00:00,5767,2080,"ભાજપ સરકારે “આત્મનિર્ભર ભારત” અભિયાનના માધ્યમથી આ દેશને પગભર બનાવવાનો સંકલ્પ લીધો છે જેના કારણે આપણા આ કાલોલ, હાલોલ, દાહોદ, ગોધરા અને વડોદરા પંથકનો અભૂતપૂર્વ વિકાસ થશે. https://t.co/SzqUUb3Dul"
Narendra Modi,1598252424036200449,2022-12-01 09:47:26+00:00,8663,2751,Himmatnagar shares a strong bond with BJP. Support from people is at an all-time high! @BJP4Gujarat. https://t.co/l0wxtpT4Lr
Narendra Modi,1598218829124943873,2022-12-01 07:33:56+00:00,9016,2790,Wonderful to be in Chhota Udepur. Amazing energy at the @BJP4Gujarat rally. https://t.co/JDBMsVJZ3i
Narendra Modi,1598210785599266816,2022-12-01 07:01:59+00:00,10271,2710,I pay my tributes to HH Pramukh Swami Maharaj Ji on his Jayanti. I consider myself blessed that I got the opportunity to interact with him on multiple occasions and also got a lot of affection from him. He is globally admired for his pioneering service to society. https://t.co/BvaO4pSr90
Narendra Modi,1598191761809018881,2022-12-01 05:46:23+00:00,8363,2793,Grateful for the immense support in Kalol. Addressing a rally. @BJP4Gujarat. https://t.co/odOlF9z74O
Narendra Modi,1598162324342583296,2022-12-01 03:49:25+00:00,28239,6507,"Today, as India begins its G-20 Presidency, penned a few thoughts on how we want to work in the coming year based on an inclusive, ambitious, action-oriented, and decisive agenda to further global good. #G20India @JoeBiden @planalto https://t.co/cB8bBRD80D"
Narendra Modi,1598135267868962816,2022-12-01 02:01:54+00:00,15172,3106,"Best wishes to the people of Nagaland on their Statehood Day. India takes great pride in the culture of Nagaland, which emphasises on courage, hardwork and living in harmony with nature. I pray for the continuous success of Nagaland in the years to come."
Narendra Modi,1598134361307910144,2022-12-01 01:58:18+00:00,20105,4134,Raising Day greetings to all @BSF_India personnel and their families. This is a force with an outstanding track record of protecting India and serving our nation with utmost diligence. I also appreciate the noble work of BSF during challenging situations like natural disasters. https://t.co/qdFCLrfZGl
Narendra Modi,1598133746200612867,2022-12-01 01:55:51+00:00,36584,6297,"Today is the first phase of the Gujarat elections. I call upon all those voting today, particularly first time voters to exercise their franchise in record numbers."
Narendra Modi,1598133576234840065,2022-12-01 01:55:11+00:00,10412,2666,"આજે ગુજરાત વિધાનસભાની ચૂંટણી માટે પ્રથમ તબક્કાનું મતદાન યોજાઈ રહ્યું છે. હું તમામ મતદાતાઓને, ખાસ કરીને પ્રથમ વખત મતાધિકારનો ઉપયોગ કરનાર યુવાનોને, વિક્રમજનક સંખ્યામાં મતદાન કરવા માટે આહ્વાન કરું છું."
Narendra Modi,1597920522993422336,2022-11-30 11:48:35+00:00,11716,3166,Manipur is known for its vibrant culture. Best wishes on the occasion of Sangai Festival. https://t.co/OUwyw8T0hR
Narendra Modi,1597892924465123328,2022-11-30 09:58:55+00:00,8387,2675,"I call upon all #ExamWarriors, their parents and teachers to take part in these interesting activities relating to Pariksha Pe Charcha 2023. Let us collectively work towards creating a stress free environment for our students. #PPC2023 https://t.co/ovubThyvP1"
Narendra Modi,1597892646944780288,2022-11-30 09:57:49+00:00,7605,2186,A very encouraging trend. Happy to see this change. Our emphasis on furthering all aspects relating to women empowerment remains very strong. https://t.co/Z4yOBLMd9N
Narendra Modi,1597892443172909056,2022-11-30 09:57:00+00:00,17265,3010,"Looks great! And, with the new airport and flights being added, more people will be able to visit Arunachal Pradesh with ease and experience the warm hospitality there. https://t.co/tcfpk4ghos"
Narendra Modi,1597606912883044354,2022-11-29 15:02:24+00:00,11180,2922,Excellent news! @GeM_India is a game changer when it comes to showcasing India’s entrepreneurial zeal and furthering transparency. I laud all those who are displaying their products on this platform and urge others to do the same. https://t.co/O2gioaxxrL
Narendra Modi,1597565503274295297,2022-11-29 12:17:51+00:00,13215,2872,India continues to make strides in the world of manufacturing. https://t.co/PfojPFYzz0
Narendra Modi,1597565176131489793,2022-11-29 12:16:33+00:00,12859,3697,We covered diverse topics during this month’s #MannKiBaat including several community efforts. Do take part in the MKB Quiz on the NaMo App. https://t.co/BkB1Qcx6iP
Narendra Modi,1597255975848640512,2022-11-28 15:47:54+00:00,22502,4859,"The rallies in Jamnagar and Rajkot witnessed record participation from first time voters. Talked about the steps taken to boost ‘Ease of Living’, improve the water situation in Saurashtra, efforts for MSMEs and more. https://t.co/QXkfk56juh"
Narendra Modi,1597254617032974336,2022-11-28 15:42:30+00:00,8490,2710,વિકસિત ગુજરાત અને વિકસિત ગુજરાત થકી વિકસિત ભારતનું સ્વપ્ન સાકાર કરવા માટે મને યુવા પેઢીના સામર્થ્ય પર ભરોસો છે…. https://t.co/9r8wb6ch0O
Narendra Modi,1597241154340196352,2022-11-28 14:49:01+00:00,9602,3113,Ecstatic mood in Rajkot. @BJP4Gujarat is people's obvious choice. https://t.co/nm0BLlSJS0
Narendra Modi,1597212491016155138,2022-11-28 12:55:07+00:00,10258,3182,Addressing a mega rally in Jamnagar. Immense fervour! @BJP4Gujarat https://t.co/zscamLFRKw
Narendra Modi,1597201942333165568,2022-11-28 12:13:12+00:00,13664,3798,"The atmosphere at the rallies in Palitana and Anjar was euphoric. Spoke about @BJP4Gujarat’s track record in sectors such as Jal Shakti, energy, boosting industrial growth and tourism. https://t.co/ywcpSoDkju"
Narendra Modi,1597200594707496963,2022-11-28 12:07:50+00:00,6236,2388,જયારે ગુજરાતમાં એક ભયાનક ભૂકંપ આવ્યો હતો ત્યારે કેટલાક લોકો કહેતા હતા કે આ રાજય ફરી ક્યારેય બેઠું નહીં થાય પરંતુ આ રાજ્યની ખમીરવંતી પ્રજાના પુરુષાર્થે તેઓની માન્યતાને ખોટી પાડી અને ગુજરાત ફિનિક્સ પંખીની માફક રાખમાંથી ઊભું થયું…. https://t.co/RnnbdVJwLK
Narendra Modi,1597200452965146624,2022-11-28 12:07:17+00:00,8480,2736,ભાજપ સરકારે ગુજરાતમાં પ્રવાસન ઉદ્યોગને ખૂબ પ્રોત્સાહન આપ્યું છે જેના આજે સુખદ પરિણામો મળી રહ્યા છે… https://t.co/wUu4oxg03O
Narendra Modi,1597200309524213760,2022-11-28 12:06:42+00:00,5913,2195,ભાગલા પાડો અને રાજ કરો એ કોંગ્રેસની વર્ષોની રાજનીતિ રહી છે જેના કારણે સમાજને ખૂબ મોટું નુકસાન થયું છે. https://t.co/deGQNuTvvE
Narendra Modi,1597177238113628160,2022-11-28 10:35:02+00:00,9042,2991,Touched by the affection in Anjar. Addressing a huge @BJP4Gujarat rally. Do watch. https://t.co/YTk1GaIRJu
Narendra Modi,1597142027879452673,2022-11-28 08:15:07+00:00,8720,2974,Outstanding rally in Palitana is an indication of the resounding support for @BJP4Gujarat among all sections of society. https://t.co/z2zZ07EjaC
